date,press,region,title,sub_title,description,content,article_url,image_url,region_kor
2026-02-23,서울신문,seoul,"한화손보, 지난해 순이익 3611억원 전년 대비 5.6%",당기순이익 전년 대비 5.6% 감소 매출 6조 9796억원 17% 증가 신규 CSM 1조 291억원 38.9% 확대,"당기순이익 전년 대비 5.6% 감소 매출 6조 9796억원 17% 증가 신규 CSM 1조 291억원 38.9% 확대 한화손해보험의 지난해 당기순이익이 소폭 감소했지만, 매출과 신계약 수익성 지표는 개선된 것으로 나타났다. 한화손보는 지난해 순이익이 3611억원으로 전년 대비 5.6% 줄었다고 23일 공시했다. 의료 이용률 상승과 계절적 요인에 따른 보험사고 증가로 보험손익이 감소한 영향이다. 반면 매출액은 6조 9796억원으로 17.0% 증가했다. 장기보장성 신계약은 899억원으로 23.6% 늘었다. 특히 신계약 CSM은 1조 291억원으로 전년보다 38.9% 증가하며 1조원을 넘어섰다. 지난해 말 기준 보유계약 CSM은 4조 694억원으로 1년 전보다 7.0% 확대됐다. 한화손보는 여성시니어 보험 등 고가치 상품 중심의 매출 확대와 영업 채널 규모 확장, 계약 품질 개선 노력이 실적에 반영됐다고 설명했다. 보험손익 둔화 속에서도 신계약 수익성을 강화하며 안정적인 성장 흐름을 이어갔다고도 밝혔다.","이미지 확대 닫기 이미지 확대 보기 한화손해보험 제공 당기순이익 전년 대비 5.6% 감소 매출 6조 9796억원 17% 증가 신규 CSM 1조 291억원 38.9% 확대 한화손해보험의 지난해 당기순이익이 소폭 감소했지만, 매출과 신계약 수익성 지표는 개선된 것으로 나타났다. 한화손보는 지난해 순이익이 3611억원으로 전년 대비 5.6% 줄었다고 23일 공시했다. 의료 이용률 상승과 계절적 요인에 따른 보험사고 증가로 보험손익이 감소한 영향이다. 반면 매출액은 6조 9796억원으로 17.0% 증가했다. 장기보장성 신계약은 899억원으로 23.6% 늘었다. 특히 신계약 CSM은 1조 291억원으로 전년보다 38.9% 증가하며 1조원을 넘어섰다. 지난해 말 기준 보유계약 CSM은 4조 694억원으로 1년 전보다 7.0% 확대됐다. 한화손보는 여성시니어 보험 등 고가치 상품 중심의 매출 확대와 영업 채널 규모 확장, 계약 품질 개선 노력이 실적에 반영됐다고 설명했다. 보험손익 둔화 속에서도 신계약 수익성을 강화하며 안정적인 성장 흐름을 이어갔다고도 밝혔다.",https:www.seoul.co.krnewseconomy2026022320260223500117,https:img.seoul.co.krimgupload20260223SSC_20260223115501_N1.png.webp,서울
2026-02-23,서울신문,seoul,[서울데이터랩]한화오션 1.13% 하락하며 하락폭 최대 기록,,"코스피 시가총액 상위 종목들이 전반적으로 엇갈린 흐름을 보이고 있다. 23일 오후 12시 20분 한국거래소에 따르면, 시가총액 1위 삼성전자(005930)는 현재가 193,000원으로 전 거래일 대비 1.53% 오르고 있다. 시가총액은 114조 2490억원이며 외국인비율은 51.09%에 달한다. 반도체 대장주인 SK하이닉스(000660)는 956,000원으로 0.74% 상승하며, 거래량은 196만 6103주를 기록하고 있다. 삼성전자우(005935)는 2.22% 상승하여 138,100원에 거래되고 있으며, 현대차(005380)는 3.14% 상승하여 525,000원에 거래되고 있다. LG에너지솔루션(373220)은 0.87% 하락한 398,000원, 삼성바이오로직스(207940)는 0.23% 하락한 1,732,000원, SK스퀘어(402340)는 0.34% 하락한 578,000원을 기록하고 있다. 기아(000270)는 0.29% 상승한 172,300원에, 두산에너빌리티(034020)는 0.10% 하락한 103,400원에 거래되고 있다. 한화에어로스페이스(012450)는 0.16% 상승한 1,244,000원이다. 한편 시가총액 20위권 종목들은 HD현대중","이미지 확대 닫기 이미지 확대 보기 코스피 시가총액 상위 종목들이 전반적으로 엇갈린 흐름을 보이고 있다. 23일 오후 12시 20분 한국거래소에 따르면, 시가총액 1위 삼성전자(005930)는 현재가 193,000원으로 전 거래일 대비 1.53% 오르고 있다. 시가총액은 114조 2490억원이며 외국인비율은 51.09%에 달한다. 반도체 대장주인 SK하이닉스(000660)는 956,000원으로 0.74% 상승하며, 거래량은 196만 6103주를 기록하고 있다. 삼성전자우(005935)는 2.22% 상승하여 138,100원에 거래되고 있으며, 현대차(005380)는 3.14% 상승하여 525,000원에 거래되고 있다. LG에너지솔루션(373220)은 0.87% 하락한 398,000원, 삼성바이오로직스(207940)는 0.23% 하락한 1,732,000원, SK스퀘어(402340)는 0.34% 하락한 578,000원을 기록하고 있다. 기아(000270)는 0.29% 상승한 172,300원에, 두산에너빌리티(034020)는 0.10% 하락한 103,400원에 거래되고 있다. 한화에어로스페이스(012450)는 0.16% 상승한 1,244,000원이다. 닫기 이미지 확대 보기 한편 시가총액 20위권 종목들은 HD현대중공업(329180) 1.08%, KB금융(105560) 0.95%, 삼성물산(028260) 보합, 셀트리온(068270) 0.41%, 신한지주(055550) 0.49%, 삼성생명(032830) 4.79%, 한화오션(042660) 1.13%, 현대모비스(012330) 0.68%, NAVER(035420) 0.98%, 한국전력(015760) 1.11% 등의 성적을 기록하고 있다. 코스피 주요 종목들은 전반적으로 혼재된 흐름을 보이고 있다. 거래량이 활발한 종목으로는 두산에너빌리티가 눈에 띄며, 상대적으로 조용한 종목은 한화에어로스페이스가 있다. [서울신문과 MetaVX의 생성형 AI가 함께 작성한 기사입니다]",https:www.seoul.co.krnewseconomysecurities2026022320260223500142,https:img.seoul.co.krimgupload20260223SSC_20260223135109_N1.png.webp,서울
2026-02-23,서울신문,seoul,[서울데이터랩]보로노이 22.08% 급등 주목 에코프로 알테오젠 상승세 유지 중,,"코스닥 주요 종목들이 전반적으로 엇갈린 흐름을 보이고 있다. 23일 한국거래소에 따르면, 시가총액 1위인 에코프로(086520)는 현재가 17만 4100원으로 전 거래일 대비 1.63% 상승하며 견조한 상승세를 이어가고 있다. 시가총액은 23조 6386억원이며, 외국인비율은 21.13%이다. 거래량은 235만 2038주를 기록하고 있다. 반면, 시가총액 2위인 알테오젠(196170)은 41만 500원으로 전 거래일 대비 2.11% 상승하며 거래량 28만 4907주를 기록 중이다. 외국인비율은 13.52%이다. 시가총액 3위부터 10위에 해당하는 종목들은 에코프로비엠(247540) -0.58%, 삼천당제약(000250) -3.89%, 레인보우로보틱스(277810) 0.28%, 에이비엘바이오(298380) 0.85%, 코오롱티슈진(950160) 6.07%, 케어젠(214370) -4.46%, 리노공업(058470) 0.10%, HLB(028300) -0.93%의 등락률을 보이고 있다. 한편 시가총액 20위권 종목들은 리가켐바이오(141080) 4.45%, 펩트론(087010) 0.36%, 원익IPS(240810) 1.84%, 보로노이(3102","мқҙлҜёмҖ нҷлҢҖ лӢкё мқҙлҜёмҖ нҷлҢҖ ліҙкё мҪмҠӨлӢҘ мЈјмҡ мўлӘлӨмқҙ м лҳм ҒмңјлЎң мҮкҲлҰ нқҗлҰмқ ліҙмқҙкі мһҲлӢӨ. 23мқј нңкөӯкұлһҳмҶҢмҗ ллҘҙлҙ, мӢңкҖмҙқмЎ 1мңмқё мҗмҪнлЎң(086520)лҠ нҳмһкҖ 17лҢ 4100мӣҗмңјлЎң м кұлһҳмқј лҢҖл 1.63% мғҒмҠнҳл кІмЎнң мғҒмҠмёлҘј мқҙмҙкҖкі мһҲлӢӨ. мӢңкҖмҙқмЎмқҖ 23мЎ 6386мөмӣҗмқҙл, мҷёкөӯмқёлмңЁмқҖ 21.13%мқҙлӢӨ. кұлһҳлҹүмқҖ 235лҢ 2038мЈјлҘј кёлЎқнҳкі мһҲлӢӨ. лҳлҙ, мӢңкҖмҙқмЎ 2мңмқё мҢнҢмҳӨм (196170)мқҖ 41лҢ 500мӣҗмңјлЎң м кұлһҳмқј лҢҖл 2.11% мғҒмҠнҳл кұлһҳлҹү 28лҢ 4907мЈјлҘј кёлЎқ мӨмқҙлӢӨ. мҷёкөӯмқёлмңЁмқҖ 13.52%мқҙлӢӨ. мӢңкҖмҙқмЎ 3мңлҖн 10мңмҗ нҙлӢнҳлҠ мўлӘлӨмқҖ мҗмҪнлЎңлм (247540) -0.58%, мӮјмІңлӢм ңмҪ(000250) -3.89%, л ҲмқёліҙмҡлЎңліҙнӢұмҠӨ(277810) 0.28%, мҗмқҙлмҳлмқҙмҳӨ(298380) 0.85%, мҪмҳӨлЎұнӢмҠҲм(950160) 6.07%, мјҖмҙм (214370) -4.46%, лҰлёкіөм(058470) 0.10%, HLB(028300) -0.93%мқҳ лұлқҪлҘ мқ ліҙмқҙкі мһҲлӢӨ. лӢкё мқҙлҜёмҖ нҷлҢҖ ліҙкё нңнҺё мӢңкҖмҙқмЎ 20мңкҢ мўлӘлӨмқҖ лҰкҖмјҗлмқҙмҳӨ(141080) вІ4.45%, нҺнҠёлЎ (087010) вј0.36%, мӣҗмқөIPS(240810) вј1.84%, ліҙлЎңлёмқҙ(310210) вІ22.08%, мқҙмҳӨнҢнҒлӢүмҠӨ(039030) 0.00%, нҒҙлһҳмӢңмҠӨ(214150) вј1.01%, лмҖмҳЁ(140410) вј4.39%, лЎңліҙнӢмҰҲ(108490) вј1.61%, HPSP(403870) вј0.11%, ISC(095340) вј3.37% лұмқҳ мұм Ғмқ кёлЎқнҳкі мһҲлӢӨ. мӢңкҖмҙқмЎ мғҒмң мўлӘлӨмқҖ лҢҖмІҙлЎң нҳјмЎмёлҘј ліҙмқҙкі мһҲмңјл, ліҙлЎңлёмқҙкҖ 22.08%мқҳ нҸӯлұмёлҘј кёлЎқнҙ лҲҲкёёмқ лҒҲлӢӨ. лҳлҙ мјҖмҙм кіј лмҖмҳЁмқҖ кҒкҒ 4.46%мҷҖ 4.39% нҳлқҪнҳл мҪмёлҘј ліҙмқҙкі мһҲлӢӨ. кұлһҳлҹү мёЎлҙмҗмң мҗмҪнлЎңмҷҖ HPSPлҠ кҒкҒ 235лҢ 2038мЈјмҷҖ 145лҢ 8459мЈјлЎң нҷңлңнң кұлһҳлҘј лӮҳнғҖлӮҙкі мһҲлӢӨ. [мңмҡёмӢ лёкіј MetaVXмқҳ мғқмұнҳ AIкҖ нЁкҳ мһмұнң кёмӮмһлӢҲлӢӨ]",https:www.seoul.co.krnewseconomysecurities2026022320260223500143,https:img.seoul.co.krimgupload20260223SSC_20260223135112_N1.png.webp,서울
2026-02-23,서울신문,seoul,[서울데이터랩]금일 코스닥 거래량 1위 대한광통신 거래대금 2272억 돌파,,"코스닥 거래량 상위 종목들이 전반적으로 엇갈린 흐름을 보인다. 23일 한국거래소에 따르면, 대한광통신(010170)이 4811만 8248주의 거래량으로 코스닥에서 실시간 거래량 1위를 기록하고 있다. 대한광통신의 현재 주가는 4855원이며, 거래대금은 2272억 2800만원으로 시가총액의 약 35.44%에 달하는 상당한 자금이 유입되었다. 등락률은 18.13%의 급등세를 보이며, PER -10.72, ROE -95.92로 재무 지표에서 부정적인 모습을 나타내고 있다. 우리기술(032820)은 3901만 5867주가 거래되며 거래량 2위를 기록 중이며, 현재 주가는 1만 6860원으로, 거래대금은 6536억 3200만원으로 시가총액의 23.23%에 해당한다. 등락률은 13.54%의 급등세를 보이며, PER 203.13, ROE -3.33으로 재무 지표에서 다소 부정적인 수치를 기록하고 있다. 큐캐피탈(016600)은 2965만 5689주의 거래량을 기록하며, 현재 주가는 411원으로 등락률은 11.08% 상승하고 있다. 흥구석유(024060)는 2562만 3603주가 거래되며, 주가는 2만 2850원으로 20.01% 급등하고 있다. TS인베스트먼트(2466","мқҙлҜёмҖ нҷлҢҖ лӢкё мқҙлҜёмҖ нҷлҢҖ ліҙкё мҪмҠӨлӢҘ кұлһҳлҹү мғҒмң мўлӘлӨмқҙ м лҳм ҒмңјлЎң мҮкҲлҰ нқҗлҰмқ ліҙмқёлӢӨ. 23мқј нңкөӯкұлһҳмҶҢмҗ ллҘҙлҙ, лҢҖнңкҙнҶөмӢ (010170)мқҙ 4811лҢ 8248мЈјмқҳ кұлһҳлҹүмңјлЎң мҪмҠӨлӢҘмҗмң мӢӨмӢңк кұлһҳлҹү 1мңлҘј кёлЎқнҳкі мһҲлӢӨ. лҢҖнңкҙнҶөмӢ мқҳ нҳмһ мЈјкҖлҠ 4855мӣҗмқҙл, кұлһҳлҢҖкёҲмқҖ 2272мө 2800лҢмӣҗмңјлЎң мӢңкҖмҙқмЎмқҳ мҪ 35.44%мҗ лӢнҳлҠ мғҒлӢнң мһҗкёҲмқҙ мң мһлҗҳмҲлӢӨ. лұлқҪлҘ мқҖ 18.13%мқҳ кёүлұмёлҘј ліҙмқҙл, PER -10.72, ROE -95.92лЎң мһлҙ мҖнңмҗмң лҖм м Ғмқё лӘЁмҠөмқ лӮҳнғҖлӮҙкі мһҲлӢӨ. мҡлҰкёмҲ (032820)мқҖ 3901лҢ 5867мЈјкҖ кұлһҳлҗҳл кұлһҳлҹү 2мңлҘј кёлЎқ мӨмқҙл, нҳмһ мЈјкҖлҠ 1лҢ 6860мӣҗмңјлЎң, кұлһҳлҢҖкёҲмқҖ 6536мө 3200лҢмӣҗмңјлЎң мӢңкҖмҙқмЎмқҳ 23.23%мҗ нҙлӢнңлӢӨ. лұлқҪлҘ мқҖ 13.54%мқҳ кёүлұмёлҘј ліҙмқҙл, PER 203.13, ROE -3.33мңјлЎң мһлҙ мҖнңмҗмң лӢӨмҶҢ лҖм м Ғмқё мҲҳмҳлҘј кёлЎқнҳкі мһҲлӢӨ. нҒҗмәҗнјнғҲ(016600)мқҖ 2965лҢ 5689мЈјмқҳ кұлһҳлҹүмқ кёлЎқнҳл, нҳмһ мЈјкҖлҠ 411мӣҗмңјлЎң лұлқҪлҘ мқҖ 11.08% мғҒмҠнҳкі мһҲлӢӨ. нқҘкөмқмң (024060)лҠ 2562лҢ 3603мЈјкҖ кұлһҳлҗҳл, мЈјкҖлҠ 2лҢ 2850мӣҗмңјлЎң 20.01% кёүлұнҳкі мһҲлӢӨ. TSмқёлІ мҠӨнҠёлЁјнҠё(246690)лҠ 2273лҢ 2384мЈјкҖ кұлһҳлҗҳл, мЈјкҖлҠ 2120мӣҗмңјлЎң 12.77% мғҒмҠнҳкі мһҲлӢӨ. лӢкё мқҙлҜёмҖ нҷлҢҖ ліҙкё нңнҺё кұлһҳлҹү мғҒмң 20мңкҢ мўлӘлӨмқҖ мӮјнңмӢңлҳнҠё(038500)(7918) вІ7.93%, KBIлнғҲ(024840)(9210) вІ20.05%, нҙмұмҳөнӢұмҠӨ(076610)(7921) вІ10.57%, мјҖмқҙлмқҙмҳӨ(038530)(4312) вј9.83%, нҳлҢҖлмқҙмҳӨ(048410)(7939) вІ26.63%, CSA мҪмҠӨлҜ(083660)(4316) вј29.81%, кёҖлЎңлІҢмҗмҠӨм (900070)(7926) вІ22.86%, нӢмЁлЁёнӢлҰмјмҰҲ(125020)(7946) вІ7.36%, мӢңмҖллңнҚ(056090)(7951) вІ22.99%, DSCмқёлІ мҠӨнҠёлЁјнҠё(241520)(7967) вІ21.07% лұмқҳ мұм Ғмқ кёлЎқнҳкі мһҲлӢӨ. нҠнһҲ нҳлҢҖADM(187660)мқҖ 2031лҢ 6377мЈјкҖ кұлһҳлҗҳл мЈјкҖкҖ 1лҢ 1320мӣҗмңјлЎң 21.98% нҸӯлұнҳмҳҖлӢӨ. кұлһҳлҢҖкёҲмқҖ 2171мө 8100лҢмӣҗмңјлЎң мӢңкҖмҙқмЎмқҳ 34.58%лҘј мЁмҖнҳкі мһҲмҙ ммӨм Ғмқё лӨмҲҳмёкҖ лӮҳнғҖлӮҳкі мһҲлӢӨ. лҳлҙ CSA мҪмҠӨлҜмқҖ 1040лҢ 6686мЈјкҖ кұлһҳлҗҳл мЈјкҖкҖ 252мӣҗмңјлЎң 29.81% нҸӯлқҪнҳмҳҖлӢӨ. кұлһҳлҢҖкёҲмқҖ 2мө 7400лҢмӣҗмңјлЎң мӢңкҖмҙқмЎ лҢҖл 1.73%мқҳ мһҗкёҲмқҙ мң мңлҗҳмҲмқҢмқ ліҙммӨҖлӢӨ. м мІҙм ҒмңјлЎң мҪмҠӨлӢҘ мӢңмһҘмқҖ клӢЁм Ғмқё лұлқҪлҘ мқ ліҙмқҙлҠ мўлӘлӨмқҙ лҺм, нҲмһҗмһҗлӨмқҳ ліҖлҸҷмұ лҰмҠӨнҒ кҙҖлҰкҖ нмҡнң мӢңм җмқҙлӢӨ. мқҙлҹнң мӢңмһҘ нқҗлҰ мҶҚмҗмң нҲмһҗмһҗлӨмқҖ кҒ кёммқҳ мһлҙ мғҒнғңмҷҖ мӢңмһҘ лӮҙ мҲҳкёү лҸҷнҘмқ лҙлҖнһҲ кҙҖмнҳм нҲмһҗ кІм мқ лӮҙлҰлҠ кІғмқҙ мӨмҡнҳлӢӨ. [мңмҡёмӢ лёкіј MetaVXмқҳ мғқмұнҳ AIкҖ нЁкҳ мһмұнң кёмӮмһлӢҲлӢӨ]",https:www.seoul.co.krnewseconomysecurities2026022320260223500144,https:img.seoul.co.krimgupload20260223SSC_20260223135118_N1.png.webp,서울
2026-02-23,서울신문,seoul,[서울데이터랩]2월 23일 암호화폐 시총 상위종목 동향,,"글로벌 가상자산 시황 중계 사이트 코인마켓캡(CoinMarketCap)에 따르면, 현재 비트코인은 9373만 591원으로 거래되고 있으며, 24시간 동안 4.50% 하락했다. 시가총액은 1873조 9969억 원이며, 최근 1시간 동안 0.32% 상승세를 보이며 단기 반등의 가능성을 시사하고 있다. 거래량은 42조 9702억 원이다. 이더리움은 269만 468원으로 24시간 동안 5.52% 하락했다. 시가총액은 324조 7189억 원이며, 1시간 등락률은 0.01%로 거의 변동이 없다. 거래량은 20조 2735억 원에 달한다. 리플은 현재 1938원으로, 24시간 동안 5.65% 하락하며 시가총액 118조 2625억 원을 기록하고 있다. 1시간 등락률은 0.16% 상승하여 단기적으로 소폭의 회복세를 나타내고 있다. 거래량은 2조 9967억 원이다. 비앤비는 85만 2344원으로 24시간 동안 4.92% 하락했다. 시가총액은 116조 2248억 원이며, 1시간 동안 0.59% 상승하여 반등의 조짐을 보이고 있다. 거래량은 2조 725억 원이다. 한편, 솔라나는 11만 2388원으로 8.40% 하락했다. 시가총액은 63조 8900억 원에 달한다. 같은 시","мқҙлҜёмҖ нҷлҢҖ лӢкё мқҙлҜёмҖ нҷлҢҖ ліҙкё кёҖлЎңлІҢ кҖмғҒмһҗмӮ мӢңнҷ мӨкі мӮмқҙнҠё мҪмқёлҲмјмәЎ(CoinMarketCap)мҗ ллҘҙлҙ, нҳмһ лнҠёмҪмқёмқҖ 9373лҢ 591мӣҗмңјлЎң кұлһҳлҗҳкі мһҲмңјл, 24мӢңк лҸҷмҲ 4.50% нҳлқҪнҲлӢӨ. мӢңкҖмҙқмЎмқҖ 1873мЎ 9969мө мӣҗмқҙл, мөңкј 1мӢңк лҸҷмҲ 0.32% мғҒмҠмёлҘј ліҙмқҙл лӢЁкё лҳлұмқҳ кҖлҠҘмұмқ мӢңмӮнҳкі мһҲлӢӨ. кұлһҳлҹүмқҖ 42мЎ 9702мө мӣҗмқҙлӢӨ. мқҙлҚлҰмӣҖмқҖ 269лҢ 468мӣҗмңјлЎң 24мӢңк лҸҷмҲ 5.52% нҳлқҪнҲлӢӨ. мӢңкҖмҙқмЎмқҖ 324мЎ 7189мө мӣҗмқҙл, 1мӢңк лұлқҪлҘ мқҖ 0.01%лЎң кұмқҳ ліҖлҸҷмқҙ мҶлӢӨ. кұлһҳлҹүмқҖ 20мЎ 2735мө мӣҗмҗ лӢнңлӢӨ. лҰнҢмқҖ нҳмһ 1938мӣҗмңјлЎң, 24мӢңк лҸҷмҲ 5.65% нҳлқҪнҳл мӢңкҖмҙқмЎ 118мЎ 2625мө мӣҗмқ кёлЎқнҳкі мһҲлӢӨ. 1мӢңк лұлқҪлҘ мқҖ 0.16% мғҒмҠнҳм лӢЁкём ҒмңјлЎң мҶҢнҸӯмқҳ нҡҢліөмёлҘј лӮҳнғҖлӮҙкі мһҲлӢӨ. кұлһҳлҹүмқҖ 2мЎ 9967мө мӣҗмқҙлӢӨ. лмӨллҠ 85лҢ 2344мӣҗмңјлЎң 24мӢңк лҸҷмҲ 4.92% нҳлқҪнҲлӢӨ. мӢңкҖмҙқмЎмқҖ 116мЎ 2248мө мӣҗмқҙл, 1мӢңк лҸҷмҲ 0.59% мғҒмҠнҳм лҳлұмқҳ мЎмҗмқ ліҙмқҙкі мһҲлӢӨ. кұлһҳлҹүмқҖ 2мЎ 725мө мӣҗмқҙлӢӨ. лӢкё мқҙлҜёмҖ нҷлҢҖ ліҙкё нңнҺё, мҶлқјлӮҳлҠ 11лҢ 2388мӣҗмңјлЎң 8.40% нҳлқҪнҲлӢӨ. мӢңкҖмҙқмЎмқҖ 63мЎ 8900мө мӣҗмҗ лӢнңлӢӨ. кҷмқҖ мӢңкҒ нҠёлЎ мқҖ 414мӣҗмңјлЎң 0.53% нҳлқҪнҲлӢӨ. кұлһҳлҹүмқҖ 7479мө 182лҢ мӣҗмқҙлӢӨ. лҸмҖмҪмқёмқҖ 134мӣҗмңјлЎң 4.55% нҳлқҪнҲмңјл, кұлһҳлҹүмқҖ 1мЎ 816мө мӣҗмқҙлӢӨ. кҷмқҖ мӢңкҒ лнҠёмҪмқё мәҗмӢңлҠ 78лҢ 734мӣҗмңјлЎң 4.80% нҳлқҪмёлҘј ліҙмҳҖлӢӨ. кұлһҳлҹүмқҖ 6718мө 6742лҢ мӣҗмқҙлӢӨ. мҗмқҙлӢӨлҠ 377мӣҗмңјлЎң 5.68% нҳлқҪнҲлӢӨ. кұлһҳлҹүмқҖ 5100мө 2319лҢ мӣҗмҗ мқҙлҘёлӢӨ. л ҲмҳӨлҠ 1лҢ 1713мӣҗмңјлЎң 1.19% нҳлқҪнҲмңјл, кұлһҳлҹүмқҖ 41мө 2042лҢ мӣҗмқҙлӢӨ. нҳмқҙнҚјлҰнҖҙлңлҠ 3лҢ 9336мӣҗмңјлЎң 8.27% нҳлқҪнҲлӢӨ. кұлһҳлҹүмқҖ 2026мө 4633лҢ мӣҗмқҙлӢӨ. кҷмқҖ мӢңкҒ мәнҶӨ лӨнҠёмӣҢнҒлҠ 231мӣҗмңјлЎң 0.13% мғҒмҠнҲлӢӨ. кұлһҳлҹүмқҖ 124мө 134лҢ мӣҗмҗ лӢнңлӢӨ. мІҙмқёлҒнҒлҠ 1лҢ 1927мӣҗмңјлЎң 6.52% нҳлқҪнҲмңјл, кұлһҳлҹүмқҖ 7321мө 3464лҢ мӣҗмқҙлӢӨ. кҷмқҖ мӢңкҒ лӘЁлӨлЎңлҠ 45лҢ 1823мӣҗмңјлЎң 3.35% нҳлқҪмёлҘј ліҙмҳҖмңјл, кұлһҳлҹүмқҖ 1084мө 5446лҢ мӣҗмқҙлӢӨ. лӢӨмқҙлҠ 1442мӣҗмңјлЎң 0.01% нҳлқҪнҲлӢӨ. кұлһҳлҹүмқҖ 1680мө 6647лҢ мӣҗмқҙлӢӨ. USD1мқҖ 1441мӣҗмңјлЎң ліҖлҸҷмқҙ мҶмңјл, кұлһҳлҹүмқҖ 2мЎ 2584мө мӣҗмқҙлӢӨ. лҲмҖлүмңјлЎң мҠӨнлқјлЈЁлҳмқҖ 217мӣҗмңјлЎң 3.51% нҳлқҪнҲлӢӨ. кұлһҳлҹүмқҖ 1670мө 7252лҢ мӣҗмқҙлӢӨ. м лҳм ҒмңјлЎң кҖмғҒмһҗмӮ мӢңмһҘмқҖ нҳлқҪмёлҘј ліҙмқҙкі мһҲмңјл, кҒ мўлӘлӨмқҳ ліҖлҸҷмұмқҙ нҒлӢӨлҠ м җмҗмң нҲмһҗмһҗлӨмқҖ мЈјмқҳнҙмј нңлӢӨ. [мңмҡёмӢ лёкіј MetaVXмқҳ мғқмұнҳ AIкҖ нЁкҳ мһмұнң кёмӮмһлӢҲлӢӨ]",https:www.seoul.co.krnewseconomyIT2026022320260223500145,https:img.seoul.co.krimgupload20260223SSC_20260223135119_N1.png.webp,서울
