date,press,region,title,sub_title,description,content,article_url,image_url,region_kor
2026-02-20,서울신문,seoul,"삼성생명, 지난해 순이익 2.3조원배당금 주당 5300원 확정",,"삼성생명이 지난해 당기순이익 2조 3028억원을 시현했다고 20일 밝혔다. 전년 대비 9.3% 늘어난 수치로, 수익성을 중심으로 신계약을 늘린 결과라는 설명이다. 이날 삼성생명은 기업설명회(IR)를 통해 이 같은 내용의 2025년 주요 결산 실적을 발표했다. 보험서비스손익은 서비스계약마진(CSM) 손익 확대와 예실차 축소 영향으로 9750억원을 기록했다. 투자손익은 자산부채관리(ALM) 원칙하 2조 220억원으로 안정적으로 관리됐다. 지난해 기말 CSM은 13조 2000억원으로 집계됐다. 특히 고수익 건강상품 판매 확대로 신계약 CSM 3조 595억원을 달성했다. 영업채널을 확대해 삼성생명 전속 설계사는 4만 3000명 수준으로 연초 대비 5000명 이상 늘었다. 운용자산은 지난해 연말 기준 247조원을 기록했다. 건전성 지표인 지급여력(K-ICS) 비율은 업계 최고 수준인 198%로 잠정 집계됐다. 주당 배당금은 전년 대비 18% 늘린 주당 5300원으로 결정했다. 삼성생명은 이익뿐 아니라, 지난해 2월 발생한 삼성전자 지분 매각 이익도 배당 재원에 포함해 2025년 배당을 결정했다며 중기 주주환원율 50%를 목표로 주당 배당금의 지속 상향을","이미지 확대 닫기 이미지 확대 보기 삼성생명 삼성생명 로고. 서울신문 DB 삼성생명이 지난해 당기순이익 2조 3028억원을 시현했다고 20일 밝혔다. 전년 대비 9.3% 늘어난 수치로, 수익성을 중심으로 신계약을 늘린 결과라는 설명이다. 이날 삼성생명은 기업설명회(IR)를 통해 이 같은 내용의 2025년 주요 결산 실적을 발표했다. 보험서비스손익은 서비스계약마진(CSM) 손익 확대와 예실차 축소 영향으로 9750억원을 기록했다. 투자손익은 자산부채관리(ALM) 원칙하 2조 220억원으로 안정적으로 관리됐다. 지난해 기말 CSM은 13조 2000억원으로 집계됐다. 특히 고수익 건강상품 판매 확대로 신계약 CSM 3조 595억원을 달성했다. 영업채널을 확대해 삼성생명 전속 설계사는 4만 3000명 수준으로 연초 대비 5000명 이상 늘었다. 운용자산은 지난해 연말 기준 247조원을 기록했다. 건전성 지표인 지급여력(K-ICS) 비율은 업계 최고 수준인 198%로 잠정 집계됐다. 주당 배당금은 전년 대비 18% 늘린 주당 5300원으로 결정했다. 삼성생명은 이익뿐 아니라, 지난해 2월 발생한 삼성전자 지분 매각 이익도 배당 재원에 포함해 2025년 배당을 결정했다며 중기 주주환원율 50%를 목표로 주당 배당금의 지속 상향을 추진할 것이라고 밝혔다.",https:www.seoul.co.krnewseconomyfinance2026022020260220500214,https:img.seoul.co.krimgupload20260220SSC_20260220154015_N1.jpg.webp,서울
2026-02-20,서울신문,seoul,[서울데이터랩]광동제약 30.00% 상한가 금일 증시 상승률 1위로 마감,,"20일 오후 3시 30분 광동제약(009290)이 등락률 30.00%로 상승률 1위로 마감했다. 광동제약은 장 중 2034만 7757주가 거래됐으며 주가는 전 거래일 대비 2400원 오른 1만 400원에 마감했다. 한편 광동제약의 PER은 18.67로, 이는 시장 평균 대비 다소 높은 평가를 받고 있을 가능성을 시사하며, ROE는 7.21%로 수익성이 보통 수준임을 나타낸다. 이어 상승률 2위 미래에셋생명(085620)은 주가가 29.98% 폭등하며 종가 1만 2400원에 상승 마감했다. 상승률 3위 롯데손해보험(000400)의 주가는 2525원으로 29.95% 폭등하며 강세를 보였다. 상승률 4위 흥국화재우(000545)는 29.92% 상승하며 9510원에 마감했다. 상승률 5위 한화생명(088350)은 29.92%의 상승세를 타고 6600원에 마감했다. 6위 SG세계물산(004060)은 591원으로 29.89% 상승 마감했다. 7위 흥국화재(000540)는 종가 5760원으로 29.88% 상승 마감했다. 8위 에이엔피(015260)는 종가 471원으로 29.75% 상승 마감했다. 9위 한국ANKOR유전(152550)은 237원으로 29.51% 상승 마","мқҙлҜёмҖ нҷлҢҖ лӢкё мқҙлҜёмҖ нҷлҢҖ ліҙкё 20мқј мҳӨнӣ 3мӢң 30л кҙлҸҷм ңмҪ(009290)мқҙ лұлқҪлҘ 30.00%лЎң мғҒмҠлҘ 1мңлЎң лҲкҗнҲлӢӨ. кҙлҸҷм ңмҪмқҖ мһҘ мӨ 2034лҢ 7757мЈјкҖ кұлһҳлҗҗмңјл мЈјкҖлҠ м кұлһҳмқј лҢҖл 2400мӣҗ мҳӨлҘё 1лҢ 400мӣҗмҗ лҲкҗнҲлӢӨ. нңнҺё кҙлҸҷм ңмҪмқҳ PERмқҖ 18.67лЎң, мқҙлҠ мӢңмһҘ нҸүк лҢҖл лӢӨмҶҢ лҶмқҖ нҸүкҖлҘј лӣкі мһҲмқ кҖлҠҘмұмқ мӢңмӮнҳл, ROEлҠ 7.21%лЎң мҲҳмқөмұмқҙ ліҙнҶө мҲҳмӨҖмһмқ лӮҳнғҖлӮёлӢӨ. мқҙмҙ мғҒмҠлҘ 2мң лҜёлһҳмҗмӢмғқлӘ(085620)мқҖ мЈјкҖкҖ 29.98% нҸӯлұнҳл мўкҖ 1лҢ 2400мӣҗмҗ мғҒмҠ лҲкҗнҲлӢӨ. мғҒмҠлҘ 3мң лЎҜлҚмҶҗнҙліҙнҳ(000400)мқҳ мЈјкҖлҠ 2525мӣҗмңјлЎң 29.95% нҸӯлұнҳл кмёлҘј ліҙмҳҖлӢӨ. мғҒмҠлҘ 4мң нқҘкөӯнҷмһмҡ(000545)лҠ 29.92% мғҒмҠнҳл 9510мӣҗмҗ лҲкҗнҲлӢӨ. мғҒмҠлҘ 5мң нңнҷмғқлӘ(088350)мқҖ 29.92%мқҳ мғҒмҠмёлҘј нғҖкі 6600мӣҗмҗ лҲкҗнҲлӢӨ. 6мң SGмёкілјмӮ(004060)мқҖ 591мӣҗмңјлЎң 29.89% мғҒмҠ лҲкҗнҲлӢӨ. 7мң нқҘкөӯнҷмһ(000540)лҠ мўкҖ 5760мӣҗмңјлЎң 29.88% мғҒмҠ лҲкҗнҲлӢӨ. 8мң мҗмқҙмнј(015260)лҠ мўкҖ 471мӣҗмңјлЎң 29.75% мғҒмҠ лҲкҗнҲлӢӨ. 9мң нңкөӯANKORмң м (152550)мқҖ 237мӣҗмңјлЎң 29.51% мғҒмҠ лҲкҗнҲлӢӨ. 10мң нҚјмҠӨнҚ(010820)мқҖ 6720мӣҗмңјлЎң 26.08% мғҒмҠ лҲкҗнҲлӢӨ. лӢкё мқҙлҜёмҖ нҷлҢҖ ліҙкё мқҙ лмҗлҸ нңнҷмҶҗнҙліҙнҳ(000370) 25.17%, TBHкёҖлЎңлІҢ(084870) 21.20%, кІҪлҸҷмқёлІ мҠӨнҠё(012320) 19.41%, SKмҰқкҢ(001510) 18.37% лұмқ кёлЎқнҳл мқҙлӮ мҰқмӢңлҘј мғҒмҠмңјлЎң лҲкҗнҲлӢӨ. [мңмҡёмӢ лёкіј MetaVXмқҳ мғқмұнҳ AIкҖ нЁкҳ мһмұнң кёмӮмһлӢҲлӢӨ]",https:www.seoul.co.krnewseconomysecurities2026022020260220500227,https:img.seoul.co.krimgupload20260220SSC_20260220162321_N1.png.webp,서울
2026-02-20,서울신문,seoul,"네이버페이 결제 오류, 외부 해킹 아닌 DB 장애 탓",,"네이버페이가 19일 2시간 넘게 이어진 결제 오류는 외부 해킹이 아니라 내부 자체 데이터베이스(DB) 관련 장애 때문인 것으로 파악했다. 네이버페이 관계자는 20일 어제 오류는 내부 로직 오류로 인한 DB 장애였다고 설명했다. 당시 오류는 오후 12시 발생해 오후 2시 20분쯤 긴급 복구됐다. 이후 과부하 방지를 위한 대기열 조치에 들어가 오후 3시 30분 과부하가 해제됐다. 이 시간 동안 포인트 조회 및 결제 결제 내역 및 이벤트 내역 조회 현장결제 포인트 및 머니 결제 페이머니카드 결제 등 서비스가 차질을 빚었다. 한편, 금융감독원은 이번 사태와 관련 네이버페이에 소비자보호 조치와 재발 방지 방안을 요구했다. 미흡하거나 내부통제가 제대로 되지 않을 경우 현장점검에 착수한다는 방침이다.","이미지 확대 닫기 이미지 확대 보기 네이버 로고. 서울신문 DB 네이버페이가 19일 2시간 넘게 이어진 결제 오류는 외부 해킹이 아니라 내부 자체 데이터베이스(DB) 관련 장애 때문인 것으로 파악했다. 네이버페이 관계자는 20일 어제 오류는 내부 로직 오류로 인한 DB 장애였다고 설명했다. 당시 오류는 오후 12시 발생해 오후 2시 20분쯤 긴급 복구됐다. 이후 과부하 방지를 위한 대기열 조치에 들어가 오후 3시 30분 과부하가 해제됐다. 이 시간 동안 포인트 조회 및 결제 결제 내역 및 이벤트 내역 조회 현장결제 포인트 및 머니 결제 페이머니카드 결제 등 서비스가 차질을 빚었다. 한편, 금융감독원은 이번 사태와 관련 네이버페이에 소비자보호 조치와 재발 방지 방안을 요구했다. 미흡하거나 내부통제가 제대로 되지 않을 경우 현장점검에 착수한다는 방침이다.",https:www.seoul.co.krnewseconomyfinance2026022020260220500199,https:img.seoul.co.krimgupload20260212SSC_20260212153454_N1.png.webp,서울
2026-02-20,서울신문,seoul,美코스트코 입점부터 라이징 브랜드 1위까지해외로 뻗는 K뷰티,,"세계적으로 K-뷰티에 대한 관심이 뜨거운 가운데 한국 화장품이 미국 시장에서 존재감을 키우고 있다. 유통망을 넓히고 브랜드 경쟁력을 강화하면서 올해 역대 최대 수출액을 경신할 것이라는 전이 나온다. 에이블씨엔씨는 자사 브랜드 미샤가 미국 시장에서 2025 라이징 뷰티 브랜드 메이크업 부문 1위에 선정됐다고 20일 밝혔다. 글로벌 크리에이터 마케팅 분석 기업 트래커가 발간한 보고서에 담긴 내용으로, 미샤는 2025년 미국 내 크리에이터 마케팅 성과 성장률 기준 메이크업 카테고리 1위를 기록했다. 해당 보고서는 2025년 1월부터 10월까지 미국 내 76만 명 이상의 인플루언서와 1000만건 이상 콘텐츠 데이터를 분석했다. 미샤는 트커의 브랜드 활력 지수를 나타내는 VIT 평가 기준에서 493% 성장률로 가장 높은 증가세를 나타냈다. VIT는 단순 노출량이 아닌 게시 빈도, 도달 규모, 참여도, 신뢰도를 종합 반영한 지표다. 보고서에 따르면 2025년 뷰티 산업은 타 산업 대비 평균적으로 높은 브랜드 활력지수를 기록하며, 크리에이터 마케팅 성과가 가장 두드러진 카테고리로 나타났다. 특히 한국 브랜드들은 틱톡과 유튜브 중심의 루틴형, 데모형 콘텐","미샤, 미국서 라이징 브랜드 1위 달바글로벌 영업이익 역대 최대 해외 매출 급증신기록 전망 이미지 확대 닫기 이미지 확대 보기 서울 시내 올리브영 매장 모습. 연합뉴스 세계적으로 K-뷰티에 대한 관심이 뜨거운 가운데 한국 화장품이 미국 시장에서 존재감을 키우고 있다. 유통망을 넓히고 브랜드 경쟁력을 강화하면서 올해 역대 최대 수출액을 경신할 것이라는 전이 나온다. 에이블씨엔씨는 자사 브랜드 미샤가 미국 시장에서 2025 라이징 뷰티 브랜드 메이크업 부문 1위에 선정됐다고 20일 밝혔다. 글로벌 크리에이터 마케팅 분석 기업 트래커가 발간한 보고서에 담긴 내용으로, 미샤는 2025년 미국 내 크리에이터 마케팅 성과 성장률 기준 메이크업 카테고리 1위를 기록했다. 해당 보고서는 2025년 1월부터 10월까지 미국 내 76만 명 이상의 인플루언서와 1000만건 이상 콘텐츠 데이터를 분석했다. 미샤는 트커의 브랜드 활력 지수를 나타내는 VIT 평가 기준에서 493% 성장률로 가장 높은 증가세를 나타냈다. VIT는 단순 노출량이 아닌 게시 빈도, 도달 규모, 참여도, 신뢰도를 종합 반영한 지표다. 보고서에 따르면 2025년 뷰티 산업은 타 산업 대비 평균적으로 높은 브랜드 활력지수를 기록하며, 크리에이터 마케팅 성과가 가장 두드러진 카테고리로 나타났다. 특히 한국 브랜드들은 틱톡과 유튜브 중심의 루틴형, 데모형 콘텐츠가 알고리즘 기반 추천 구조와 맞물리며 확산을 이끌었다는 설명이다. 에이블씨엔씨 미샤는 이번 성과의 주요 전환점으로 지난해 글로벌 아티스트가 대표 제품 M 퍼펙트 커버 세럼 BB크림을 직접 소개하며 화제를 모은 사례를 꼽았다. 조예서 에이블씨엔씨 브랜드전략부문 부문장은 이번 성과는 단순한 화제성이나 일시적 바이럴을 넘어 제품력에 기반한 콘텐츠 확산 전략이 미국 시장에서 의미 있는 반응을 이끌어낸 결과라고 했다. 달바글로벌도 연간 영업이익과 매출 모두 최대를 기록했다고 이날 공시했다. 달바글로벌은 연결 기준 작년 영업이익이 1011억원으로 전년보다 68.9% 증가한 것으로 잠정 집계됐다고 밝혔다. 매출은 5198억원으로 68.2% 늘었고 순이익은 790억원으로 412.9% 증가했다. 이 가운데 해외 매출이 131.3% 증가한 3261억원으로 전체의 62.7%를 차지했다. 달바글로벌은 지난해 4분기 해외에서 온라인 채널 성장이 지속했다고 설명했다. 또 지난해 12월부터는 미국 코스트코 150개 매장과 얼타 뷰티 1500개 매장에 입점하며 북미 오프라인 시장 진출이 본격화했다. 달바글로벌 앞으로 인도와 중동 등 신흥시장을 개척하고 뷰티 기기(디바이스)와 메이크업 카테고리를 확대하는 한편 고부가 가치 신제품을 육성할 것이라고 했다. 이를 통해 올해 매출을 7000억원으로 끌어올리고, 해외 매출 비중을 70%로 높이는 게 목표다. 식품의약품안전처에 따르면 지난해 K-뷰티 수출액은 전년 대비 12.3% 증가한 114억 3100만달러(약 16조 6200억원)로 역대 최고치를 기록했다. 수출국도 2024년 172개국에서 2025년 202개국으로 1년 새 30개국 늘었다. 화장품 업계 관계자는 흐름이 유지된다면 올해도 사상 최고 수출액을 경신할 가능성이 크다고 했다.",https:www.seoul.co.krnewseconomydistribution2026022020260220500143,https:img.seoul.co.krimgupload20260220SSC_20260220131010_N1.jpg.webp,서울
2026-02-20,서울신문,seoul,코스피 장중 5800 돌파기관 1.2조 순매수에 랠리,,"코스피가 장중 5800선도 넘어서며 파죽지세 랠리를 이어가고 있다. 20일 한국거래소에 따르면 이날 오후 1시 55분 현재 코스피는 전 거래일 대비 123.84포인트(2.19%) 오른 5800.53를 가리키고 있다. 5660대로 상승 출발한 코스피는 장중 가파르게 올라, 5700선을 넘어 5800선을 찍었다. 장중 한때 5806.60까지 올랐다. 삼성전자 약세에도 SK하이닉스가 6%대 큰 폭 오르며 지수 상승 폭을 확대했다. 이날 SK하이닉스는 글로벌 1위 자산운용사 블랙록이 5%대 지분율을 확보했다고 공시하면서 장중 신고가를 계속해서 갈아치우고 있다. 미국과 이란 간 전쟁 긴장감이 높아지며 방산주도 강세를 보이고 있다. 투자자별로는 기관이 1조 1908억원 순매수하며 지수 상승을 견인 중이다. 반면 개인과 외국인은 각각 4810억원, 8008억원 순매도하고 있다.","мқҙлҜёмҖ нҷлҢҖ лӢкё мқҙлҜёмҖ нҷлҢҖ ліҙкё мҪмҠӨнј мһҘмӨ 5800м лҸҢнҢҢ мнлүҙмҠӨ мҪмҠӨнјкҖ мһҘмӨ 5800м лҸ лҳмҙмңл нҢҢмЈҪмҖмё лһ лҰлҘј мқҙмҙкҖкі мһҲлӢӨ. 20мқј нңкөӯкұлһҳмҶҢмҗ ллҘҙлҙ мқҙлӮ мҳӨнӣ 1мӢң 55л нҳмһ мҪмҠӨнјлҠ м кұлһҳмқј лҢҖл 123.84нҸмқёнҠё(2.19%) мҳӨлҘё 5800.53лҘј кҖлҰнӮӨкі мһҲлӢӨ. 5660лҢҖлЎң мғҒмҠ мңлңнң мҪмҠӨнјлҠ мһҘмӨ кҖнҢҢлҘҙкІҢ мҳлқј, 5700м мқ лҳмҙ 5800м мқ мҚмҲлӢӨ. мһҘмӨ нңлҢ 5806.60кҢмҖ мҳлһҗлӢӨ. мӮјмұм мһҗ мҪмёмҗлҸ SKнҳмқҙлӢүмҠӨкҖ 6%лҢҖ нҒ нҸӯ мҳӨлҘҙл мҖмҲҳ мғҒмҠ нҸӯмқ нҷлҢҖнҲлӢӨ. мқҙлӮ SKнҳмқҙлӢүмҠӨлҠ кёҖлЎңлІҢ 1мң мһҗмӮмҡҙмҡмӮ лёлһҷлЎқмқҙ 5%лҢҖ мҖлмңЁмқ нҷліҙнҲлӢӨкі кіөмӢңнҳлҙмң мһҘмӨ мӢ кі кҖлҘј кімҶҚнҙмң кҲммҳмҡкі мһҲлӢӨ. лҜёкөӯкіј мқҙлһҖ к м мҹҒ кёҙмһҘкҗмқҙ лҶммҖл лмӮмЈјлҸ кмёлҘј ліҙмқҙкі мһҲлӢӨ. нҲмһҗмһҗлілЎңлҠ кёкҙҖмқҙ 1мЎ 1908мөмӣҗ мҲңлӨмҲҳнҳл мҖмҲҳ мғҒмҠмқ кІмқё мӨмқҙлӢӨ. лҳлҙ кңмқёкіј мҷёкөӯмқёмқҖ кҒкҒ 4810мөмӣҗ, 8008мөмӣҗ мҲңлӨлҸнҳкі мһҲлӢӨ.",https:www.seoul.co.krnewseconomysecurities2026022020260220500154,https:img.seoul.co.krimgupload20260220SSC_20260220100038_N1.jpg.webp,서울
2026-02-20,서울신문,seoul,SK하이닉스 95만원 돌파하루 새 6%대 쑥,,"SK하이닉스가 96만원도 넘어서며 하루 새 6%가 넘는 상승률을 보이고 있다. 20일 한국거래소에 따르면 이날 오후 1시 47분 현재 SK하이닉스는 전날 대비 6.49% 오른 95만 2000원에 거래되고 있다. 하락 출발했지만, 장중 한때 95만 3000원까지 찍으며 상승 폭을 확대하고 있다. 이날 강세는 블랙록이 SK하이닉스 지분율을 5%대 확보하며 4대 주주로 올라선 데 기인한 것으로 해석된다.","이미지 확대 닫기 이미지 확대 보기 뉴시스 SK하이닉스가 96만원도 넘어서며 하루 새 6%가 넘는 상승률을 보이고 있다. 20일 한국거래소에 따르면 이날 오후 1시 47분 현재 SK하이닉스는 전날 대비 6.49% 오른 95만 2000원에 거래되고 있다. 하락 출발했지만, 장중 한때 95만 3000원까지 찍으며 상승 폭을 확대하고 있다. 이날 강세는 블랙록이 SK하이닉스 지분율을 5%대 확보하며 4대 주주로 올라선 데 기인한 것으로 해석된다.",https:www.seoul.co.krnewseconomysecurities2026022020260220500156,https:img.seoul.co.krimgupload20240806SSC_20240806185254_N1.jpg.webp,서울
2026-02-20,서울신문,seoul,[서울데이터랩]금일 코스닥 거래량 1위 우리기술 거래대금 790억 돌파,,"코스닥 거래량 상위 종목들이 전반적으로 상승세를 보이고 있다. 20일 한국거래소에 따르면, 우리기술(032820)이 5천300만주 이상 거래되며 코스닥 종목 중 실시간 거래량 1위를 기록하고 있다. 현재 주가는 15,290원이며, 거래대금은 790억 2천600만원으로 시가총액의 약 3.1%에 해당하는 높은 수준이다. PER은 184.22로 높으며 ROE는 -3.33으로 부진한 재무 상태를 나타내고 있다. 대한광통신(010170)은 거래량 4천600만주를 넘어서며 거래량 2위를 기록 중이다. 현재 주가는 4,280원이며, 거래대금은 189억 7천200만원으로 시가총액의 약 3.4%에 이른다. PER은 -9.45, ROE는 -95.92로 부정적인 재무 지표를 보이고 있다. 현대ADM(187660)은 현재가 9,530원, 등락률 8.42%로, 거래량은 2천680만주에 달한다. 케이바이오(038530)는 현재가 440원으로 9.45% 상승했으며, 거래량은 2천660만주에 이르고 있다. 앱튼(270520)은 238원으로 12.26% 상승하며, 거래량은 1천920만주를 기록 중이다. 아이에이(038880)는 130원으로 4% 상승했으며, 거래량은 1천700만주에 달","мқҙлҜёмҖ нҷлҢҖ лӢкё мқҙлҜёмҖ нҷлҢҖ ліҙкё мҪмҠӨлӢҘ кұлһҳлҹү мғҒмң мўлӘлӨмқҙ м лҳм ҒмңјлЎң мғҒмҠмёлҘј ліҙмқҙкі мһҲлӢӨ. 20мқј нңкөӯкұлһҳмҶҢмҗ ллҘҙлҙ, мҡлҰкёмҲ (032820)мқҙ 5мІң300лҢмЈј мқҙмғҒ кұлһҳлҗҳл мҪмҠӨлӢҘ мўлӘ мӨ мӢӨмӢңк кұлһҳлҹү 1мңлҘј кёлЎқнҳкі мһҲлӢӨ. нҳмһ мЈјкҖлҠ 15,290мӣҗмқҙл, кұлһҳлҢҖкёҲмқҖ 790мө 2мІң600лҢмӣҗмңјлЎң мӢңкҖмҙқмЎмқҳ мҪ 3.1%мҗ нҙлӢнҳлҠ лҶмқҖ мҲҳмӨҖмқҙлӢӨ. PERмқҖ 184.22лЎң лҶмңјл ROEлҠ -3.33мңјлЎң лҖмнң мһлҙ мғҒнғңлҘј лӮҳнғҖлӮҙкі мһҲлӢӨ. лҢҖнңкҙнҶөмӢ (010170)мқҖ кұлһҳлҹү 4мІң600лҢмЈјлҘј лҳмҙмңл кұлһҳлҹү 2мңлҘј кёлЎқ мӨмқҙлӢӨ. нҳмһ мЈјкҖлҠ 4,280мӣҗмқҙл, кұлһҳлҢҖкёҲмқҖ 189мө 7мІң200лҢмӣҗмңјлЎң мӢңкҖмҙқмЎмқҳ мҪ 3.4%мҗ мқҙлҘёлӢӨ. PERмқҖ -9.45, ROEлҠ -95.92лЎң лҖм м Ғмқё мһлҙ мҖнңлҘј ліҙмқҙкі мһҲлӢӨ. нҳлҢҖADM(187660)мқҖ нҳмһкҖ 9,530мӣҗ, лұлқҪлҘ 8.42%лЎң, кұлһҳлҹүмқҖ 2мІң680лҢмЈјмҗ лӢнңлӢӨ. мјҖмқҙлмқҙмҳӨ(038530)лҠ нҳмһкҖ 440мӣҗмңјлЎң 9.45% мғҒмҠнҲмңјл, кұлһҳлҹүмқҖ 2мІң660лҢмЈјмҗ мқҙлҘҙкі мһҲлӢӨ. мұнҠј(270520)мқҖ 238мӣҗмңјлЎң 12.26% мғҒмҠнҳл, кұлһҳлҹүмқҖ 1мІң920лҢмЈјлҘј кёлЎқ мӨмқҙлӢӨ. ммқҙмҗмқҙ(038880)лҠ 130мӣҗмңјлЎң 4% мғҒмҠнҲмңјл, кұлһҳлҹүмқҖ 1мІң700лҢмЈјмҗ лӢнңлӢӨ. мҗмҺҲнҢнҒ(043340)лҠ 644мӣҗмңјлЎң 1.68% нҳлқҪ, кұлһҳлҹүмқҖ 1мІң440лҢмЈјлӢӨ. мҳӨлҘҙлнҚ(046120)мқҖ 7,110мӣҗмңјлЎң 13.40% мғҒмҠнҳл кұлһҳлҹүмқҖ 1мІң350лҢмЈјлҘј кёлЎқнҳкі мһҲлӢӨ. мҳӨлҰмнҠём кіө(065500)мқҖ 2,860мӣҗмңјлЎң 9.37% мғҒмҠ, кұлһҳлҹүмқҖ 1мІң330лҢмЈјлӢӨ. нқҘкөмқмң (024060)лҠ 17,540мӣҗмңјлЎң 14.57% мғҒмҠнҳл кұлһҳлҹүмқҖ 1мІң100лҢмЈјмҗ мқҙлҘёлӢӨ. лӢкё мқҙлҜёмҖ нҷлҢҖ ліҙкё нңнҺё кұлһҳлҹү мғҒмң 20мңкҢ мўлӘлӨмқҖ нңҙлҰјлЎңлҙҮ(090710) вІ4.21%, нңҙлҘмҠӨ(115160) вІ14.39%, нҒҗмәҗнјнғҲ(016600) вІ6.49%, нӢмЁлЁёнӢлҰмјмҰҲ(125020) вІ1.13%, мӮјнңмӢңлҳнҠё(038500) вІ2.70%, млЎңлҲнӢмҙ(0015N0) вІ16.58%, лмҳнҢңнҚ(065170) вј3.30%, SKAI(357880) вІ7.66%, ммҠӨнҠё(067390) вІ8.00%, нқмкёлЈ(900270) вј2.19% лұмқҳ мұм Ғмқ кёлЎқнҳкі мһҲлӢӨ. нҠнһҲ млЎңлҲнӢмҙлҠ кұлһҳлҹү 770лҢмЈј, кұлһҳлҢҖкёҲ 114мө 1мІңлҢмӣҗмқ кёлЎқнҳл 16.58% кёүлұнҳкі мһҲлӢӨ. нқҘкөмқмң лҠ кұлһҳлҹү 1мІң100лҢмЈј, кұлһҳлҢҖкёҲ 195мө 1мІң380лҢмӣҗмңјлЎң 14.57% мғҒмҠмёлҘј ліҙмқёлӢӨ. лҳлҙ, лмҳнҢңнҚмқҖ 3.30% нҳлқҪнҳл кұлһҳлҹү 760лҢмЈј, кұлһҳлҢҖкёҲ 37мө 7мІң450лҢмӣҗмңјлЎң лҖмнң нқҗлҰмқ ліҙмқҙкі мһҲкі , мҗмҺҲнҢнҒлҠ 1.68% нҳлқҪнҳл кұлһҳлҹү 1мІң440лҢмЈј, кұлһҳлҢҖкёҲ 10мө 7мІң760лҢмӣҗмқ кёлЎқ мӨмқҙлӢӨ. м мІҙм ҒмңјлЎң мҪмҠӨлӢҘ мӢңмһҘмқҖ лӢӨмнң мўлӘлӨмқҙ мғҒмҠмёлҘј ліҙмқҙл нҷңлңнң кұлһҳкҖ мқҙлЈЁмҙмҖкі мһҲлӢӨ. нҠнһҲ кұлһҳлҢҖкёҲмқҙ лҶмқҖ мўлӘлӨмқҖ нҲмһҗмһҗлӨмқҳ кҙҖмӢмқ лҒҢл мӢңмһҘмқҳ мӨмӢмҗ мң мһҲлӢӨ. [мңмҡёмӢ лёкіј MetaVXмқҳ мғқмұнҳ AIкҖ нЁкҳ мһмұнң кёмӮмһлӢҲлӢӨ]",https:www.seoul.co.krnewseconomysecurities2026022020260220500161,https:img.seoul.co.krimgupload20260220SSC_20260220140333_N1.png.webp,서울
