date,press,region,title,sub_title,description,content,article_url,image_url,region_kor
2026-02-24,서울신문,seoul,"론스타 이어 엘리엇에도 완승 한국, 1600억원 안줘도 된다","PCA, 2023년 1억 782만弗 지급 판정 정부, 중재지 英법원에 취소 소송 정성호 인용률 3% 바늘구멍 뚫어","PCA, 2023년 1억 782만弗 지급 판정 정부, 중재지 英법원에 취소 소송 정성호 인용률 3% 바늘구멍 뚫어 한국 정부가 미국계 사모펀드 엘리엇매니지먼트(엘리엇)에게 1600억원을 지급하라는 국제투자분쟁(ISDS) 판정에 불복해 제기한 취소 소송에서 승소했다. 이번 판결로 정부의 배상 책임을 인정한 기존 판정이 취소되면서 사건은 중재 절차로 환송됐고, 국고 유출도 막게 됐다. 정성호 법무부 장관은 23일 정부서울청사에서 브리핑을 열고 원 판정에서 인정된 정부의 배상 원금 및 이자 등 합계 약 1600억원의 배상 의무는 잠정적으로 소멸되어 다시 판단하게 됐다고 밝혔다. 엘리엇은 2015년 삼성물산과 제일모직 합병 과정에서 한국 정부가 국민연금을 동원해 부당하게 개입해 7억 7000만 달러(약 1조원)의 손해를 입었다며 2018년 7월 한미 자유무역협정(FTA)에 근거해 ISDS를 제기했다. 한국 정부가 이재용 삼성전자 회장의 승계 작업을 위해 국민연금공단에 찬성표를 던지도록 압력을 행사했다는 주장이었다. 국정농단 특검에서 수사한 내용이기도 하다. 국제상설중재재판소(PCA)는 2023년 6월 엘리엇 측 주장을 일부 받아들여 한국 정부가 엘","ISDS 분쟁서 또 승소 PCA, 2023년 1억 782만弗 지급 판정 정부, 중재지 英법원에 취소 소송 정성호 인용률 3% 바늘구멍 뚫어 이미지 확대 닫기 이미지 확대 보기 정성호(오른쪽) 법무부 장관이 23일 서울 종로구 정부서울청사에서 정부가 미국계 사모펀드 엘리엇을 상대로 한 국제투자분쟁(ISDS) 사건 중재판정의 영국 법원 취소 소송 승소와 관련해 브리핑하고 있다. 정 장관은 정부는 향후 환송 중재 절차에서도 최선을 다하는 한편 우리나라의 ISDS 대응 체제를 더욱 발전시키기 위한 법률 제정도 추진해 국민과 국익을 철저히 보호하겠다고 말했다. 연합뉴스 한국 정부가 미국계 사모펀드 엘리엇매니지먼트(엘리엇)에게 1600억원을 지급하라는 국제투자분쟁(ISDS) 판정에 불복해 제기한 취소 소송에서 승소했다. 이번 판결로 정부의 배상 책임을 인정한 기존 판정이 취소되면서 사건은 중재 절차로 환송됐고, 국고 유출도 막게 됐다. 정성호 법무부 장관은 23일 정부서울청사에서 브리핑을 열고 원 판정에서 인정된 정부의 배상 원금 및 이자 등 합계 약 1600억원의 배상 의무는 잠정적으로 소멸되어 다시 판단하게 됐다고 밝혔다. 엘리엇은 2015년 삼성물산과 제일모직 합병 과정에서 한국 정부가 국민연금을 동원해 부당하게 개입해 7억 7000만 달러(약 1조원)의 손해를 입었다며 2018년 7월 한미 자유무역협정(FTA)에 근거해 ISDS를 제기했다. 한국 정부가 이재용 삼성전자 회장의 승계 작업을 위해 국민연금공단에 찬성표를 던지도록 압력을 행사했다는 주장이었다. 국정농단 특검에서 수사한 내용이기도 하다. 국제상설중재재판소(PCA)는 2023년 6월 엘리엇 측 주장을 일부 받아들여 한국 정부가 엘리엇 청구 금액 중 약 7%인 690억원과 지연이자 등 합계 약 1556억원(약 1억 782만 달러)을 지급하라고 판결했다. 정부는 PCA가 관할권이 없는 사건을 판정했다며 중재지인 영국 법원에 취소 소송을 냈다. 1심 재판부는 소송을 각하했지만 항소법원은 지난해 7월 한국 정부의 항소를 받아들여 사건을 파기 환송했다. 법원은 국민연금공단에 대해 정부와 별개의 법인격을 보유한 점 공적연금기금의 운용이 치안국방 등 국가의 핵심 기능에 해당하지 않는 점 국민연금의 일상적 의사결정이 정부에 완전히 종속되지 않는 점 등을 들어 국민연금이 국가기관임을 전제로 한 판단 부분을 취소했다. 이번 승소 판결로 정부의 배상 책임을 인정한 기존 원 중재 판정은 더는 유지될 수 없게 됐고, 사건은 중재 절차로 다시 환송됐다. 닫기 이미지 확대 보기 정 장관은 이번 승소는 한 번에 얻은 결과가 아니다. 정부는 처음에 취소 소송에서 각하 판결을 받았으나 지난해 7월 항소심에서 이 각하 판결을 뒤집고, 12월 파기환송심까지 철저한 준비 끝에 오늘의 승소 판결을 거뒀다며 국민연금을 지켜낸 소중한 판결이라고 강조했다. 그는 정부는 국민연금 기금 운용의 독립성과 자율성을 인정받기 위해 원 중재 절차의 서면구술 공방 때부터 국민연금공단이 국제법상 국가기관이 아니라는 주장을 지속적으로 개진했고 받아들여졌다며 정부는 엘리엇의 6분의 1에 불과한 소송비용을 쓰고도 취소 소송 인용률 3%의 바늘구멍을 뚫어냈다고 밝혔다. 영국 법원의 중재 판정 취소 인용률은 3%에 불과한데, 정정 신청취소 소송항소 등을 이어가며 일관된 법리를 주장한 결과 성과를 만들어냈다는 설명이다. 정부는 지난해 11월 론스타와 ISDS에서 승소한 데 이어 엘리엇과 분쟁에서도 승소하며 총 5600억원 규모의 국고 유출을 막는 성과를 냈다. 당시 승소로 정부가 지급하지 않은 배상 원금 및 이자는 4000억원에 이른다. 론스타는 2012년 한국 정부가 외환은행 매각 과정에 부당하게 개입해 손해를 봤다며 ISDS를 제기했다. 법무부는 론스타 ISDS 취소 절차 정부 완승이라는 성과를 거둔 법무부 ISDS 대응팀을 중심으로 보건복지부 등 관계 부처 국제투자분쟁대응단과 국내외 정부 대리인단이 헌신하여 이룬 또 다른 성과라고 밝혔다. 향후 정부는 구체적 취소 범위와 소송비용 분담 등 쟁점에 대한 대응에도 만전을 기하고, 엘리엇 측 항소 제기에도 대비하는 등 국익을 최우선으로 하여 대응할 계획이다. 또 관련 법령에 위배되지 않는 범위에서 관련 정보를 최대한 공개하는 한편 남은 절차에서도 전문성을 활용해 관계 부처외부 전문가 및 국내외 정부 대리인단과 긴밀히 협력해 대처할 예정이다. 2026-02-24 B1면",https:www.seoul.co.krnewseconomy2026022420260224029003,https:img.seoul.co.krimgupload20260223SSC_20260223223932_N1.jpg.webp,서울
2026-02-24,서울신문,seoul,내 주문 제대로 됐을까 증권사 9곳 전산장애 168건배상 53억,,"장 초반에 급등하길래 팔려고 했는데, 화면이 멈췄어요. 서울 서초구에 사는 직장인 김정우(32)씨는 지난해 12월 한 대형 증권사의 모바일트레이딩시스템(MTS) 접속 지연을 겪었다. 20여분을 기다리는 사이 보유 종목 주가는 급등 뒤 급락했고, 김씨는 당초보다 낮은 가격에 매도했다. 증권사 측은 구체적인 손실을 배상받으려면 주문 시점과 체결 지연 사이의 인과관계를 입증하라고 했다. 코스피가 사상 최고치를 경신하는 활황장에서도 투자자 신뢰는 시스템 앞에서 멈출 수 있다는 지적이 나오는 이유다. 23일 서울신문이 이헌승 국민의힘 의원실로부터 확보한 금융감독원의 증권사 전산장애 발생 및 배상 현황 자료에 따르면, 가입자 500만계좌 이상 9개 증권사(한국투자KB미래에셋삼성NH투자키움신한투자카카오페이토스)에서 20222025년 4년간 발생한 전산장애는 총 168건으로 집계됐다. 올해 1월 115일에도 3건이 추가돼 누적 171건으로 늘었다. 같은 기간 국내 10대 증권사들은 합산 순이익 9조 112억원을 기록하며 사상 최대 실적을 냈다. 실적은 뛰었지만, 거래 인프라는 그 속도를 따라가지 못한 셈이다. 연도별로는 2023년 58건으로","내부 요인 69% MTS 장애가 최다 전산운영비 늘었지만 여전히 불안 체결 지연 인과관계 입증해야 배상 투자자 기회 손실은 통계 안 잡혀 이미지 확대 닫기 이미지 확대 보기 장 초반에 급등하길래 팔려고 했는데, 화면이 멈췄어요. 서울 서초구에 사는 직장인 김정우(32)씨는 지난해 12월 한 대형 증권사의 모바일트레이딩시스템(MTS) 접속 지연을 겪었다. 20여분을 기다리는 사이 보유 종목 주가는 급등 뒤 급락했고, 김씨는 당초보다 낮은 가격에 매도했다. 증권사 측은 구체적인 손실을 배상받으려면 주문 시점과 체결 지연 사이의 인과관계를 입증하라고 했다. 코스피가 사상 최고치를 경신하는 활황장에서도 투자자 신뢰는 시스템 앞에서 멈출 수 있다는 지적이 나오는 이유다. 23일 서울신문이 이헌승 국민의힘 의원실로부터 확보한 금융감독원의 증권사 전산장애 발생 및 배상 현황 자료에 따르면, 가입자 500만계좌 이상 9개 증권사(한국투자KB미래에셋삼성NH투자키움신한투자카카오페이토스)에서 20222025년 4년간 발생한 전산장애는 총 168건으로 집계됐다. 올해 1월 115일에도 3건이 추가돼 누적 171건으로 늘었다. 같은 기간 국내 10대 증권사들은 합산 순이익 9조 112억원을 기록하며 사상 최대 실적을 냈다. 실적은 뛰었지만, 거래 인프라는 그 속도를 따라가지 못한 셈이다. 연도별로는 2023년 58건으로 정점을 찍은 뒤 감소했지만, 4년 연속 두 자릿수 사고가 이어졌다는 점에서 일시적 현상으로 보긴 어렵다. 특히 장애 원인 가운데 시스템설비 문제 64건, 프로그램 오류 52건으로 내부 요인이 전체의 69.0%를 차지했다. 외부 요인(41건24.4%)보다 내부 인프라와 소프트웨어 관리 영역의 비중이 컸다는 점에서, 단순히 장이 급등하거나 거래가 몰린 탓으로만 돌리기 어렵다는 지적이 나온다. 채널별로 보면 4년간 누적 168건 가운데 모바일트레이딩시스템(MTS) 장애가 98건으로 가장 많았다. 홈트레이딩시스템(HTS) 단독 장애는 26건, 두 시스템이 동시에 멈춘 경우는 44건이었다. 개인 투자자의 거래 상당 부분이 스마트폰을 통해 이뤄지는 구조에서 MTS 장애는 곧바로 손실로 연결될 가능성이 크다. 전산운영비는 2022년 1조 5943억원에서 2025년 2조 1094억원으로 32% 늘었지만, 전산장애에 따른 배상액은 4년간 52억 6853만원에 그쳤다. 최철 숙명여대 소비자경제학과 교수는 현행 배상 체계는 로그 기록상 명확히 확인된 손실만 인정하는 구조여서 주문 지연 같은 몇 분 사이의 기회손실은 통계에 반영되기 어렵다고 말했다. 이어 이 같은 한계가 반복되면 배상 규모와 별개로 소비자 신뢰가 훼손될 수 있는 만큼, 증권사들이 전산 안정성 강화에 보다 적극적으로 나서야 한다고 덧붙였다. 한편, 이날 코스피는 종가 기준 5846.09로 사상 최고치를 기록했고, 장중에는 5930선을 넘어서며 역대 고점을 새로 썼다. 삼성전자와 SK하이닉스가 장중 최고가를 경신하며 지수를 견인했다. 2026-02-24 B2면",https:www.seoul.co.krnewseconomy2026022420260224030001,https:img.seoul.co.krimgupload20260223SSC_20260223181135_N1.jpg.webp,서울
2026-02-24,서울신문,seoul,한국 경제 타코 트럼프에 내성 김정관 불확실성 증대될 것,15% 관세에도 코스피 한때 최고치 원달러 환율도 6.6원 내려 1440.0원 관세 휘두르던 시대 종식에 안도 구윤철 부총리 FTA 효과로 유리 2.5% 기본 관세국보다는 여유 생겨,"15% 관세에도 코스피 한때 최고치 원달러 환율도 6.6원 내려 1440.0원 관세 휘두르던 시대 종식에 안도 구윤철 부총리 FTA 효과로 유리 2.5% 기본 관세국보다는 여유 생겨 미국 연방대법원의 상호관세 무효 판결에 맞서 도널드 트럼프 미국 대통령이 15% 글로벌 관세, 무역법 301조(슈퍼 301조) 등 다양한 보복성 카드를 꺼내 들었다. 지난해 같았으면 코스피와 원달러 환율이 출렁이며 경제가 휘청거릴 정도의 거센 압박이다. 하지만 국내 경제 지표는 대체로 안정적인 모습을 보이고 있다. 트럼프 대통령의 위협적인 관세 압박을 버틸 수 있는 탄탄한 경제 굳은살이 생긴 모습이다. 트럼프 대통령의 상호관세 위법 판결과 새로운 15% 관세 압박이 있고 난 이후 첫 국내 증시 거래일인 23일 코스피는 전 거래일 대비 37.56 포인트(0.65%) 오른 5846.09로 장을 마쳤다. 이날 5903.11로 출발한 코스피는 장 초반 5931.86까지 치솟으면 역대 최고가를 경신하기도 했다. 원달러 환율 역시 장 중 한때 1430원대까지 저점을 낮추다 전 거래일보다 6.6원 내린 1440.0원으로 주간 거래 종가를 형성했다. 지난해 트럼프 대통령","관세 보복에도 국내 시장은 안정 15% 관세에도 코스피 한때 최고치 원달러 환율도 6.6원 내려 1440.0원 관세 휘두르던 시대 종식에 안도 구윤철 부총리 FTA 효과로 유리 2.5% 기본 관세국보다는 여유 생겨 이미지 확대 닫기 이미지 확대 보기 김정관(왼쪽 네 번째) 산업통상부 장관이 23일 서울 중구 대한상공회의소에서 열린 미국 연방대법원의 상호관세 판결 및 미 행정부의 추가 관세 조치 관련 민간합동 대책회의에서 발언하고 있다. 홍윤기 기자 미국 연방대법원의 상호관세 무효 판결에 맞서 도널드 트럼프 미국 대통령이 15% 글로벌 관세, 무역법 301조(슈퍼 301조) 등 다양한 보복성 카드를 꺼내 들었다. 지난해 같았으면 코스피와 원달러 환율이 출렁이며 경제가 휘청거릴 정도의 거센 압박이다. 하지만 국내 경제 지표는 대체로 안정적인 모습을 보이고 있다. 트럼프 대통령의 위협적인 관세 압박을 버틸 수 있는 탄탄한 경제 굳은살이 생긴 모습이다. 트럼프 대통령의 상호관세 위법 판결과 새로운 15% 관세 압박이 있고 난 이후 첫 국내 증시 거래일인 23일 코스피는 전 거래일 대비 37.56 포인트(0.65%) 오른 5846.09로 장을 마쳤다. 이날 5903.11로 출발한 코스피는 장 초반 5931.86까지 치솟으면 역대 최고가를 경신하기도 했다. 원달러 환율 역시 장 중 한때 1430원대까지 저점을 낮추다 전 거래일보다 6.6원 내린 1440.0원으로 주간 거래 종가를 형성했다. 지난해 트럼프 대통령의 관세 발언 한마디에 폭락장을 맞았던 것과는 양상이 확연하게 달랐다. 지난해 4월 2일(현지시간) 트럼프 대통령이 한국을 최악의 침해국으로 지목하며 25%의 상호관세를 부과한다고 한 이후 4월 7일 코스피(2328.20)는 전 거래일 대비 5.57% 폭락했다. 이어 지난해 7월 4일 상호관세율을 적시한 관세 서한을 발송하겠다고 예고했을 때 1.99%, 9월 26일 한국의 대미투자액 3500억 달러는 선불이라고 압박했을 2.45%씩 급락했다. 이미지 확대 닫기 이미지 확대 보기 하지만 최근에는 트럼프 대통령의 압박이 통하지 않고 있다. 지난달 26일 한국의 대미투자특별법 입법이 지연되고 있다는 점은 문제 삼으며 한국산에 대한 관세를 15%에서 25%로 올리겠다고 했을 때 코스피는 오히려 2.73% 반등했다. 미국이 이제 쌀 시장 개방 등 비관세 장벽까지 언급하며 보복관세에 나서겠다고 엄포를 놓는 상황에서도 시장은 안정된 모습을 보이고 있다. 이형일 재정경제부 제1차관 주재로 열린 시장상황 점검회의에서 참석자들은 판결 당일 미국, 유럽 주가가 상승하고 달러 인덱스도 안정적인 모습을 보이는 등 글로벌 시장 영향을 제한적이라고 평가했다. 전문가들은 트럼프 리스크의 성격이 변했기 때문이라고 분석했다. 올해 11월 미국의 중간선거를 앞두고 시장도 트럼프 대통령이 마음대로 관세를 휘두르던 시대가 저물어 간다고 인식한다는 것이다. 양준석 가톨릭대 경제학과 교수는 무역법 301조 등을 적용하려면 사전 조사 절차를 거쳐야 하다 보니 당장 관세가 오르지 않아 시간적 여유가 생겼다면서 트럼프 대통령 마음대로 관세율을 정하던 방식이 제약받게 된 점을 시장이 긍정적으로 평가하는 것이라고 분석했다. 허준영 서강대 경제학과 교수는 미 연방대법원의 판결이 시장의 예상에서 벗어나지 않았기 때문이라고 봤다. 다만 정부는 불확실성이 커졌다는 점은 예의주시하고 있다. 김정관 산업통상부 장관은 민관합동 대책회의에서 글로벌 통상환경 불확실성이 한층 증대될 것이라고 우려했다. 구윤철 부총리 겸 재경부 장관은 국회 재정경제기획위원회 업무보고에서 15% 관세가 부과되면 한미 자유무역협정(FTA)으로 기본세율이 0%여서 2.5%인 나라보다 유리하다고 말했다. 2026-02-24 8면",https:www.seoul.co.krnewseconomy2026022420260224008001,https:img.seoul.co.krimgupload20260223SSC_20260223180154_N1.jpg.webp,서울
2026-02-24,서울신문,seoul,AI 비서만 믿다가 보안 발등 찍힐라,,"인공지능(AI) 에이전트(비서) 도입 및 확산으로 사이버 보안 위협이 높아져 안전장치를 강화해야 한다는 분석이 23일 나왔다. 삼성SDS는 올해 기업에 영향을 끼칠 5대 사이버 위협을 이날 발표했다. 우선 자율적 업무 수행 주체로 발전 중인 AI 에이전트의 실행 과정에서 과도한 위임 및 권한 남용을 통해 데이터 유출, 무단 작업, 시스템 손상을 초래할 수 있다고 우려했다. 삼성SDS는 AI에 최소 권한을 부여하고, 정보 변경이나 결제 등 민감한 명령 수행 시 AI 가드레일을 통한 실시간 모니터링 및 이상 행위를 탐지차단해야 한다고 설명했다. 차량 주행 중 도로 이탈을 막는 물리적 가드레일처럼 AI가 의도하지 않은 행동을 막을 장치가 필요하다는 것이다. 악성 소프트웨어인 랜섬웨어도 위협 요인이다. 최근 랜섬웨어는 피해 기업의 데이터 암호화, 탈취 데이터의 공개 협박, 디도스(DDoS) 공격, 피해 기업의 고객파트너미디어 대상 압박 등 4중 갈취 형태로 진화하고 있다. 이에 대응하려면 조기 복구 및 정상화를 위한 백업 체계 확보 등이 필요하다. 이외 클라우드 보안 위협, 피싱 및 계정 탈취, 중요 데이터에 대한 무단 접근손상유출 등을 경고했다.","мВЉмДSDS, кЉлПДнХЬ кґМнХЬ мЬДмЮД кљк мЭЄкµмІАлК(AI) мЧРмЭімДнКЄ(лєДмДЬ) лПДмЮЕ лП нЩХмВмЬЉлЬ мВђмЭілД лімХИ мЬДнШСмЭі лЖТмХДмЄ мХИмДмЮмєШлЉ кХнЩФнХімХЉ нХЬлЛлКФ лґДмДЭмЭі 23мЭЉ лВШмЩФлЛ. мВЉмДSDSлКФ мШђнХі кЄмЧЕмЧР мШБнЦмЭД лБЉмє 5лМА мВђмЭілД мЬДнШСмЭД мЭілВ лЬнСЬнЦИлЛ. мЪмД мЮРмЬмБ мЧЕлђі мИШнЦЙ мЉмілЬ лЬмД мСмЭЄ AI мЧРмЭімДнКЄмЭШ мЛнЦЙ кЉмХмЧРмДЬ кЉлПДнХЬ мЬДмЮД лП кґМнХЬ лВмЪмЭД нЖµнХі лНмЭінД мЬмґЬ, лђілЛ мЮСмЧЕ, мЛЬмКнЕЬ мЖРмГБмЭД міИлЮШнХ мИШ мЮИлЛк мЪлнЦИлЛ. мВЉмДSDSлКФ вАЬAIмЧР мµЬмЖМ кґМнХЬмЭД лґАмЧђнХШк, мХлі лАкљмЭілВШ кмЬ лУ лѓЉкРнХЬ лЕлє мИШнЦЙ мЛЬ AI кАлУЬлИмЭЉмЭД нЖµнХЬ мЛмЛЬкД ллЛИнДлІБ лП мЭімГБ нЦЙмЬДлЉ нГРмІАЈмлЛнХімХЉ нХЬлЛвАЭк мДлЕнЦИлЛ. млЯЙ мЉнЦЙ мС лПДлЬ мЭінГИмЭД лІЙлКФ лђЉлђмБ кАлУЬлИмЭЉмШлЯЉ AIкА мЭШлПДнХШмІА мХКмЭА нЦЙлПЩмЭД лІЙмЭД мЮмєШкА нХДмЪФнХШлЛлКФ кГмЭілЛ. мХЕмД мЖМнФДнКЄмЫмЦімЭЄ лЮЬмДђмЫмЦілПД мЬДнШС мЪФмЭЄмЭілЛ. мµЬкЈЉ лЮЬмДђмЫмЦілКФ нФЉнХі кЄмЧЕмЭШ лНмЭінД мХФнШЄнЩФ, нГИмЈ лНмЭінДмЭШ кµкЬ нШСлХ, лФФлПДмК(DDoS) кµк, нФЉнХі кЄмЧЕмЭШ ккЭЈнММнКЄлДИЈлѓЄлФФмЦі лМАмГБ мХХлХ лУ 4мС кИмЈ нШХнГЬлЬ мІДнЩФнХШк мЮИлЛ. мЭімЧР лМАмЭСнХШллі мкЄ лµкµђ лП мХмГБнЩФлЉ мЬДнХЬ лмЧЕ мікД нЩХлі лУмЭі нХДмЪФнХШлЛ. мЭімЩЄ нБілЭЉмЪлУЬ лімХИ мЬДнШС, нФЉмЛ лП кДмХ нГИмЈ, мСмЪФ лНмЭінДмЧР лМАнХЬ лђілЛ мСкЈЉЈмЖРмГБЈмЬмґЬ лУмЭД кљкнЦИлЛ. 2026-02-24 B1лі",https:www.seoul.co.krnewseconomyIT2026022420260224029001,,서울
