date,press,region,title,sub_title,description,content,article_url,image_url,region_kor
2026-02-19,서울신문,seoul,"잠수함 수주 총력 한화오션, 캐나다 기술이전인력양성 맞손",,"최대 60조원 규모의 캐나다 초계 잠수함 프로젝트(CPSP) 수주전을 벌이는 한화오션이 캐나다 조선소 및 대학과 손잡고 현지 조선업 역량 재건과 기술 이전 등 협력을 강화한다. 한화오션은 캐나다 토론토에서 온타리오 조선소와 전략적 협력을 위한 양해각서(MOU)를 체결하고 온타리오 조선소, 모호크 대학과는 3자 간 전략적 협력 의향서(LOI)를 맺었다고 19일 밝혔다. 먼저 한화오션은 온타리오 조선소에 설계엔지니어링 자문, 생산 계획 수립공정 관리, 품질 관리 시스템 구축, 스마트 조선소 기반 첨단 공정 등 조선 기술과 운영 노하우를 제공한다. 온타리오 조선소는 1987년 설립된 오대호 지역 최대 조선소로 총 6개의 독과 100개 이상의 유지보수정비(MRO) 수행 실적을 보유하고 있다. 한화오션은 온타리오주의 대형 선박 건조 역량을 단계적으로 재건하고 캐나다의 장기적인 해군 산업 기반 강화를 지원한다는 구상이다. 양사는 CPSP를 포함한 향후 캐나다 해군 사업을 염두에 둔 협력도 추진해나가기로 했다. 이어 온타리오 조선소, 모호크 대학과 손잡고 온타리오 조선소에 조선 인력양성 허브를 구축하기로 했다. 향후 1015년간 조선소 확장현대화 계","온타리오 조선소모호크 대학과 전략적 협력 양해각서 등 체결 수주 땐 교육산업 등 협력 확대 이미지 확대 닫기 이미지 확대 보기 폴 암스트롱(앞줄 왼쪽부터) 모호크대학 총장, 김희철 한화오션 대표, 숀 파둘로 온타리오조선소 대표가 전략적 협력 의향서(LOI)를 체결한 뒤 캐나다 국회의원 등 관계자들과 함께 기념촬영을 하고 있다. 한화오션 제공 최대 60조원 규모의 캐나다 초계 잠수함 프로젝트(CPSP) 수주전을 벌이는 한화오션이 캐나다 조선소 및 대학과 손잡고 현지 조선업 역량 재건과 기술 이전 등 협력을 강화한다. 한화오션은 캐나다 토론토에서 온타리오 조선소와 전략적 협력을 위한 양해각서(MOU)를 체결하고 온타리오 조선소, 모호크 대학과는 3자 간 전략적 협력 의향서(LOI)를 맺었다고 19일 밝혔다. 먼저 한화오션은 온타리오 조선소에 설계엔지니어링 자문, 생산 계획 수립공정 관리, 품질 관리 시스템 구축, 스마트 조선소 기반 첨단 공정 등 조선 기술과 운영 노하우를 제공한다. 온타리오 조선소는 1987년 설립된 오대호 지역 최대 조선소로 총 6개의 독과 100개 이상의 유지보수정비(MRO) 수행 실적을 보유하고 있다. 한화오션은 온타리오주의 대형 선박 건조 역량을 단계적으로 재건하고 캐나다의 장기적인 해군 산업 기반 강화를 지원한다는 구상이다. 양사는 CPSP를 포함한 향후 캐나다 해군 사업을 염두에 둔 협력도 추진해나가기로 했다. 이어 온타리오 조선소, 모호크 대학과 손잡고 온타리오 조선소에 조선 인력양성 허브를 구축하기로 했다. 향후 1015년간 조선소 확장현대화 계획과 연계해 용접제작해양 기계전기로보틱스비파괴검사 등 핵심 인력을 양성할 계획이다. 세 기관은 통합형 교육 캠퍼스 구축, 산업 주도형 고급 교육 프로그램 개발, 인력양성 체계 확립, 가상현실로보틱스디지털 트윈을 활용한 연구 과제 발굴도 추진할 예정이다. 한화오션이 CPSP 사업을 수주할 경우 온타리오주 내 조선 전문 교육훈련센터 설립 등 전략적 투자와 현지 업체와의 산업 협력도 확대하기로 했다. 숀 파둘로 온타리오 조선소 대표는 한화오션과의 파트너십을 통해 세계적 수준의 조선 전문성과 검증된 생산 시스템을 도입해 조선 역량 재건과 고품질 일자리 창출, 온타리오 및 캐나다 해양방산 산업 기반 강화를 가속할 것이라고 말했다. 김희철 한화오션 대표는 오늘 맺은 두 개의 약속은 한화오션과 온타리오 조선소의 미래이자 캐나다와 대한민국 간 우정을 더욱 깊게 해주는 계기라면서 CPSP를 포함한 캐나다 해군 사업의 성공적인 수행을 위한 기반을 확고히 구축해 나가겠다고 강했다.",https:www.seoul.co.krnewseconomyindustry2026021920260219500183,https:img.seoul.co.krimgupload20260219SSC_20260219152409_N1.jpg.webp,서울
2026-02-19,서울신문,seoul,"안경 다음은 손목...메타의 귀환, 애플삼성 양강 체제 흔드나",,"메타가 한 차례 포기했던 스마트워치 시장에 다시 도전장을 내밀며 웨어러블 시장의 판도 변화를 예고했다. 18일(현지시간) 미 IT 전문매체 디인포메이션에 따르면, 메타는 말리부2라는 코드명으로 스마트워치 재출시를 확정하고 마크 저커버그 CEO의 주도 아래 연내 제품 공개를 목표로 개발에 박차를 가하고 있다. 이번 재도전은 최근 메타의 스마트 안경 하이퍼노바 등이 시장에서 기대 이상의 흥행을 거두며 웨어러블 기기 사업에 대한 자신감을 회복한 결과로 풀이된다. 메타는 과거 리얼리티랩스의 대규모 구조조정 상황 속에서도 웨어러블 관련 인력을 유지하며 AI와 건강 관리 기능을 탑재한 차세대 워치 개발을 지속해온 것으로 알려졌다. 메타의 참전으로 애플, 삼성, 구글이 장악해온 손목 위 플랫폼 전쟁은 2라운드에 접어들 전망이다. 현재 스마트워치 시장은 고혈압 알림 등 일상적 건강 모니터링의 편의성을 앞세운 애플이 1위를 수성하고 있으며, 삼성전자는 최근 갤럭시 링과 갤럭시 워치를 AI로 결합해 수면부터 활동량까지 분석하는 정밀한 헬스케어 생태계를 구축하며 추격 중이다. 메타는 기존 강자들과의 차별화 포인트로 스마트 안경과의 연동성을 내세운다.","이미지 확대 닫기 이미지 확대 보기 마크 주커버그 메타 CEO가 25일 메타 커넥트 컨퍼런스에서 가상현실(AR) 안경을 착용하고 있다. 캘리포니아 AP PhotoGodofredo A. VÃsquez 메타가 한 차례 포기했던 스마트워치 시장에 다시 도전장을 내밀며 웨어러블 시장의 판도 변화를 예고했다. 18일(현지시간) 미 IT 전문매체 디인포메이션에 따르면, 메타는 말리부2라는 코드명으로 스마트워치 재출시를 확정하고 마크 저커버그 CEO의 주도 아래 연내 제품 공개를 목표로 개발에 박차를 가하고 있다. 이번 재도전은 최근 메타의 스마트 안경 하이퍼노바 등이 시장에서 기대 이상의 흥행을 거두며 웨어러블 기기 사업에 대한 자신감을 회복한 결과로 풀이된다. 메타는 과거 리얼리티랩스의 대규모 구조조정 상황 속에서도 웨어러블 관련 인력을 유지하며 AI와 건강 관리 기능을 탑재한 차세대 워치 개발을 지속해온 것으로 알려졌다. 메타의 참전으로 애플, 삼성, 구글이 장악해온 손목 위 플랫폼 전쟁은 2라운드에 접어들 전망이다. 현재 스마트워치 시장은 고혈압 알림 등 일상적 건강 모니터링의 편의성을 앞세운 애플이 1위를 수성하고 있으며, 삼성전자는 최근 갤럭시 링과 갤럭시 워치를 AI로 결합해 수면부터 활동량까지 분석하는 정밀한 헬스케어 생태계를 구축하며 추격 중이다. 메타는 기존 강자들과의 차별화 포인트로 스마트 안경과의 연동성을 내세운다. 안경과 워치를 연결해 스마트폰 없이도 완벽한 AI 에이전트 경험을 제공하는 독자적인 인터페이스를 구축하겠다는 구상이다. 이는 삼성이 링과 워치를 조합해 신체 데이터를 수집하는 방식과는 또 다른 형태의 웨어러블 시너지를 지향한다. 업계에서는 메타가 보유한 방대한 소셜 미디어 데이터가 AI 건강 관리 서비스와 결합될 때 발생할 파급력에 주목하고 있다. 이미 헬스케어 데이터를 선점한 애플과 삼성에 맞서 메타가 개인 맞춤형 AI 비서 기능을 얼마나 혁신적으로 구현하느냐가 이번 손목 위 전쟁의 승패를 결정할 주요 변수가 될 전망이다.",https:www.seoul.co.krnewseconomyindustry2026021920260219500120,https:img.seoul.co.krimgupload20260219SSC_20260219130700_N1.jpg.webp,서울
2026-02-19,서울신문,seoul,"LG AI연구원, 2025 AI 윤리 책무성 보고서 발간",,,"한국적 맥락 강한 소버린 AI 입증 상업적 안전성 21.2% 확인 딥페이크 등 미래 위협 선제 대응 닫기 이미지 확대 보기 이홍락(왼쪽)임우형 LG AI연구원 공동 연구원장. LG 제공 LG AI연구원이 인공지능(AI) 개발의 안전성과 윤리 실천 현황을 담은 2025 AI 윤리 책무성 보고서를 19일 발간했다. LG AI연구원은 2023년부터 매년 관련 보고서를 발간하며 AI 윤리 실천 노력을 계열사 전반으로 넓히고 있다. 보고서의 핵심은 지역적 특수성과 문화적 맥락을 정확히 반영하는 소버린 AI의 구현 역량이다. 글로벌 거대언어모델(LLM)들이 국가별 역사나 지리적 쟁점에 대해 중립적인 답변을 유지하거나 오류를 범하는 사례가 보고되는 가운데, LG의 K-EXAONE은 한국적 맥락에서 높은 신뢰도를 나타냈다. 실제 역사 왜곡 및 독도 문제 등 국내 특화 이슈 226개 항목으로 구성된 한국형 AI 안전성 평가(KGC-SAFETY) 결과, K-EXAONE은 96.1점을 기록하며 국내 환경에 최적화된 답변 성능을 보였다. 데이터 저작권 준수를 위한 기술적 성과도 공개됐다. LG는 자체 AI 에이전트 Nexus를 통해 오픈 데이터셋 2800여개를 전수 조사했다. 분석 결과 상업적 이용이 가능한 데이터는 21.2% 수준으로 나타났으며, LG는 이러한 식별 기술을 활용해 저작권 침해 위험을 줄인 데이터만을 선별 학습에 활용하고 있다. 이는 법률 전문가 대비 월등히 빠른 속도로 데이터의 법적 위험성을 검토함으로써 AI 개발의 투명성을 높인 사례로 꼽힌다. 미래 발생 가능한 잠재적 위험에 대해서는 선제적인 관리 체계를 수립했다. 보고서에는 AI가 국가 암호 체계에 영향을 미치거나 인간의 의사결정을 조작할 수 있는 시나리오 등 고위험군 관리 항목(K-AUT)이 명시됐다. 예를 들어, 보이스피싱에 악용될 수 있는 딥페이스 음성 생성이나 개인의 금융 정보를 탈취하기 위한 고도화된 사회 공학적 공격 시나리오 등이 이에 해당한다. LG는 2026년부터 모든 연구 과제를 위험도에 따라 이원화하여 관리하는 프로세스를 공식 도입할 계획이다. 이홍락 LG AI연구원 공동 연구원장은 변화하는 글로벌 규제에 수동적으로 대응하기보다 기술의 안전과 신뢰를 선제적으로 확보하는 데 집중하고 있다며 보고서의 발간 취지를 설명했다. LG는 이번 보고서를 통해 글로벌 기준에 부합하는 AI 윤리 표준을 제시하는 한편, 특정 문화권에 편향되지 않으면서도 한국적 가치를 명확히 반영하는 기술 경쟁력을 지속적으로 고도화해 나갈 방침이다.",https:www.seoul.co.krnewseconomyindustry2026021920260219500125,https:img.seoul.co.krimgupload20260219SSC_20260219131616_N1.png.webp,서울
2026-02-19,서울신문,seoul,"AI 바빌론, CES 화제의 AI 번역 안경 Leion Hey2 국내 와디즈 출시",,"인공지능 솔루션 기업 AI 바빌론이 글로벌 AR 전문 기업 LLVision의 혁신적인 AR 번역 안경 Leion Hey2를 크라우드 펀딩 플랫폼 와디즈를 통해 공식 출시한다고 밝혔다. Leion Hey2는 CES 2026에서 차세대 웨어러블 디바이스로 각광받으며 전 세계 관람객과 미디어의 이목을 집중시킨 제품이다. 에이빙뉴스 등 국내외 유력 IT 매체를 통해 기술력을 입증받았으며, 국내 얼리어답터들 사이에서도 출시 전부터 기대를 모아왔다. AI 바빌론이 한국 시장에 단독으로 선보이는 이번 제품은 더 많이, 더 빠르게, 더 길게라는 핵심 가치를 지향한다. 특히 0.5초 미만의 번역 지연 속도는 대화 상대방의 언어를 실시간 자막으로 끊김 없이 확인하게 해준다. 배터리 성능 또한 강화돼 한 번 충전으로 최대 68시간 연속 사용이 가능하므로 비즈니스 미팅이나 장거리 여행 시에도 안정적으로 활용할 수 있다. 언어 지원 범위도 넓다. 프로 버전 기준 전 세계 100여 개 이상의 언어를 실시간 번역할 수 있어 실질적인 언어 장벽 해소를 돕는다. 이는 LLVision의 AR 기술 노하우와 AI 바빌론의 국내 시장 최적화 전략이 결합돼 사용자에게 최상의 소통","이미지 확대 닫기 이미지 확대 보기 Leion Hey2 page on Wadiz 인공지능 솔루션 기업 AI 바빌론이 글로벌 AR 전문 기업 LLVision의 혁신적인 AR 번역 안경 Leion Hey2를 크라우드 펀딩 플랫폼 와디즈를 통해 공식 출시한다고 밝혔다. Leion Hey2는 CES 2026에서 차세대 웨어러블 디바이스로 각광받으며 전 세계 관람객과 미디어의 이목을 집중시킨 제품이다. 에이빙뉴스 등 국내외 유력 IT 매체를 통해 기술력을 입증받았으며, 국내 얼리어답터들 사이에서도 출시 전부터 기대를 모아왔다. AI 바빌론이 한국 시장에 단독으로 선보이는 이번 제품은 더 많이, 더 빠르게, 더 길게라는 핵심 가치를 지향한다. 특히 0.5초 미만의 번역 지연 속도는 대화 상대방의 언어를 실시간 자막으로 끊김 없이 확인하게 해준다. 배터리 성능 또한 강화돼 한 번 충전으로 최대 68시간 연속 사용이 가능하므로 비즈니스 미팅이나 장거리 여행 시에도 안정적으로 활용할 수 있다. 이미지 확대 닫기 이미지 확대 보기 Leion Hey2 at CES 2026 언어 지원 범위도 넓다. 프로 버전 기준 전 세계 100여 개 이상의 언어를 실시간 번역할 수 있어 실질적인 언어 장벽 해소를 돕는다. 이는 LLVision의 AR 기술 노하우와 AI 바빌론의 국내 시장 최적화 전략이 결합돼 사용자에게 최상의 소통 경험을 제공할 것으로 전망된다. AI 바빌론 관계자는 CES 2026에서 혁신성을 인정받은 Leion Hey2를 한국 소비자들에게 선보이게 돼 뜻깊다며 단순한 기기를 넘어 일상과 비즈니스 현장에서 소통의 방식을 근본적으로 바꾸는 도구가 될 것이라고 강조했다. Leion Hey2의 와디즈 펀딩은 2월 27일부터 공식 신청 및 결제가 가능하며, 펀딩 참여자에게는 얼리버드 할인가 혜택을 제공한다. 제품 배송은 3월 11일부터 순차적으로 진행할 예정이며, 상세 정보는 와디즈 공식 홈페이지 내 펀딩 페이지에서 확인할 수 있다.",https:www.seoul.co.krnewseconomy2026021920260219500130,https:img.seoul.co.krimgupload20260219SSC_20260219132951_N1.jpg.webp,서울
2026-02-19,서울신문,seoul,[서울데이터랩]미래에셋증권 13.96% 급등하며 시장 이목 집중,,"코스피 시가총액 상위 종목들이 전반적으로 엇갈린 흐름을 보이고 있다. 19일 오후 12시 20분 한국거래소에 따르면, 시가총액 1위 삼성전자(005930)는 현재가 18만 8500원으로 전 거래일 대비 4.03% 오르며 상승세를 이어가고 있다. 시가총액은 111조 5851억원이며, 외국인비율은 51.42%로 나타난다. SK하이닉스(000660)는 현재가 89만 2000원으로 1.36% 상승 중이며, 시가총액 64조 9378억원 가운데 외국인비율은 53.13%를 기록하고 있다. 삼성전자우(005935)는 4.70% 상승하며, 현대차(005380)는 0.40% 상승하고 있다. LG에너지솔루션(373220)은 1.14%, 삼성바이오로직스(207940)는 1.58%의 상승세를 보인다. SK스퀘어(402340)는 2.78%, 기아(000270)는 2.86% 상승 중이며, 두산에너빌리티(034020)는 2.17% 오름세를 보인다. KB금융(105560)은 0.71% 하락하고 있다. 한편 시가총액 20위권 종목들은 HD현대중공업(329180) 5.71%, 한화에어로스페이스(012450) 2.99%, 셀트리온(068270) 2.63%, 삼성물산(028260)","мқҙлҜёмҖ нҷлҢҖ лӢкё мқҙлҜёмҖ нҷлҢҖ ліҙкё мҪмҠӨнј мӢңкҖмҙқмЎ мғҒмң мўлӘлӨмқҙ м лҳм ҒмңјлЎң мҮкҲлҰ нқҗлҰмқ ліҙмқҙкі мһҲлӢӨ. 19мқј мҳӨнӣ 12мӢң 20л нңкөӯкұлһҳмҶҢмҗ ллҘҙлҙ, мӢңкҖмҙқмЎ 1мң мӮјмұм мһҗ(005930)лҠ нҳмһкҖ 18лҢ 8500мӣҗмңјлЎң м кұлһҳмқј лҢҖл 4.03% мҳӨлҘҙл мғҒмҠмёлҘј мқҙмҙкҖкі мһҲлӢӨ. мӢңкҖмҙқмЎмқҖ 111мЎ 5851мөмӣҗмқҙл, мҷёкөӯмқёлмңЁмқҖ 51.42%лЎң лӮҳнғҖлӮңлӢӨ. SKнҳмқҙлӢүмҠӨ(000660)лҠ нҳмһкҖ 89лҢ 2000мӣҗмңјлЎң 1.36% мғҒмҠ мӨмқҙл, мӢңкҖмҙқмЎ 64мЎ 9378мөмӣҗ кҖмҡҙлҚ мҷёкөӯмқёлмңЁмқҖ 53.13%лҘј кёлЎқнҳкі мһҲлӢӨ. мӮјмұм мһҗмҡ(005935)лҠ 4.70% мғҒмҠнҳл, нҳлҢҖмЁ(005380)лҠ 0.40% мғҒмҠнҳкі мһҲлӢӨ. LGмҗлҲмҖмҶлЈЁмҳ(373220)мқҖ 1.14%, мӮјмұлмқҙмҳӨлЎңмҒмҠӨ(207940)лҠ 1.58%мқҳ мғҒмҠмёлҘј ліҙмқёлӢӨ. SKмҠӨнҖҳмҙ(402340)лҠ 2.78%, кём(000270)лҠ 2.86% мғҒмҠ мӨмқҙл, лҗмӮмҗлҲлҢлҰнӢ(034020)лҠ 2.17% мҳӨлҰмёлҘј ліҙмқёлӢӨ. KBкёҲмңө(105560)мқҖ 0.71% нҳлқҪнҳкі мһҲлӢӨ. лӢкё мқҙлҜёмҖ нҷлҢҖ ліҙкё нңнҺё мӢңкҖмҙқмЎ 20мңкҢ мўлӘлӨмқҖ HDнҳлҢҖмӨкіөм(329180) вІ5.71%, нңнҷмҗмҙлЎңмҠӨнҺҳмқҙмҠӨ(012450) вІ2.99%, мҖнҠёлҰмҳЁ(068270) вІ2.63%, мӮјмұлјмӮ(028260) вј0.47%, мӢ нңмҖмЈј(055550) вј1.76%, нңнҷмҳӨмҳ(042660) вІ8.32%, мӮјмұмғқлӘ(032830) вІ0.97%, нңкөӯм л Ҙ(015760) вІ4.68%, нҳлҢҖлӘЁлмҠӨ(012330) вІ0.92%, лҜёлһҳмҗмӢмҰқкҢ(006800) вІ13.96% лұмқҳ мұм Ғмқ кёлЎқнҳкі мһҲлӢӨ. мӢңкҖмҙқмЎ мғҒмң мўлӘлӨмқҖ лӢӨмнң лұлқҪлҘ мқ ліҙмқҙл нҷңлңнң кұлһҳлҘј мқҙмҙкҖкі мһҲлӢӨ. нҠнһҲ, лҜёлһҳмҗмӢмҰқкҢмқҖ мғҒлӢнң мғҒмҠнҸӯмқ кёлЎқнҳл мЈјлӘлӣкі мһҲлӢӨ. [мңмҡёмӢ лёкіј MetaVXмқҳ мғқмұнҳ AIкҖ нЁкҳ мһмұнң кёмӮмһлӢҲлӢӨ]",https:www.seoul.co.krnewseconomysecurities2026021920260219500135,https:img.seoul.co.krimgupload20260219SSC_20260219133537_N1.png.webp,서울
2026-02-19,서울신문,seoul,[서울데이터랩]2월 19일 암호화폐 시총 상위종목 동향,,"글로벌 가상자산 시황 중계 사이트 코인마켓캡(CoinMarketCap)에 따르면, 비트코인은 현재 9713만 5483원에 거래되고 있으며, 시가총액은 1941조 8976억 원이다. 24시간 동안 비트코인은 1.05% 하락했으며, 1시간 등락률은 0.18% 상승을 기록하고 있어 단기적으로 반등 가능성이 나타나고 있다. 거래량은 47조 9341억 원에 달한다. 이더리움의 현재가는 286만 2538원이고, 시가총액은 345조 4866억 원이다. 24시간 동안 1.27% 하락했으나 1시간 동안 0.21% 상승하는 모습을 보여 반등의 조짐을 보이고 있다. 이더리움의 거래량은 28조 2768억 원이다. 리플은 2073원에 거래되고 있으며, 시가총액은 126조 3346억 원이다. 최근 24시간 동안 3.51% 하락했으나, 1시간 등락률은 0.33% 상승을 기록하고 있어 단기 회복에 대한 기대가 있다. 거래량은 3조 922억 원이다. 비앤비는 현재 88만 1832원에 거래되며, 시가총액은 120조 2459억 원이다. 24시간 동안 1.83% 하락했으며, 1시간 동안 0.40% 상승하여 단기적으로는 회복세를 보이고 있다. 비앤비의 거래량은 2조 1124억 원이다.","мқҙлҜёмҖ нҷлҢҖ лӢкё мқҙлҜёмҖ нҷлҢҖ ліҙкё кёҖлЎңлІҢ кҖмғҒмһҗмӮ мӢңнҷ мӨкі мӮмқҙнҠё мҪмқёлҲмјмәЎ(CoinMarketCap)мҗ ллҘҙлҙ, лнҠёмҪмқёмқҖ нҳмһ 9713лҢ 5483мӣҗмҗ кұлһҳлҗҳкі мһҲмңјл, мӢңкҖмҙқмЎмқҖ 1941мЎ 8976мө мӣҗмқҙлӢӨ. 24мӢңк лҸҷмҲ лнҠёмҪмқёмқҖ 1.05% нҳлқҪнҲмңјл, 1мӢңк лұлқҪлҘ мқҖ 0.18% мғҒмҠмқ кёлЎқнҳкі мһҲмҙ лӢЁкём ҒмңјлЎң лҳлұ кҖлҠҘмұмқҙ лӮҳнғҖлӮҳкі мһҲлӢӨ. кұлһҳлҹүмқҖ 47мЎ 9341мө мӣҗмҗ лӢнңлӢӨ. мқҙлҚлҰмӣҖмқҳ нҳмһкҖлҠ 286лҢ 2538мӣҗмқҙкі , мӢңкҖмҙқмЎмқҖ 345мЎ 4866мө мӣҗмқҙлӢӨ. 24мӢңк лҸҷмҲ 1.27% нҳлқҪнҲмңјлӮҳ 1мӢңк лҸҷмҲ 0.21% мғҒмҠнҳлҠ лӘЁмҠөмқ ліҙм лҳлұмқҳ мЎмҗмқ ліҙмқҙкі мһҲлӢӨ. мқҙлҚлҰмӣҖмқҳ кұлһҳлҹүмқҖ 28мЎ 2768мө мӣҗмқҙлӢӨ. лҰнҢмқҖ 2073мӣҗмҗ кұлһҳлҗҳкі мһҲмңјл, мӢңкҖмҙқмЎмқҖ 126мЎ 3346мө мӣҗмқҙлӢӨ. мөңкј 24мӢңк лҸҷмҲ 3.51% нҳлқҪнҲмңјлӮҳ, 1мӢңк лұлқҪлҘ мқҖ 0.33% мғҒмҠмқ кёлЎқнҳкі мһҲмҙ лӢЁкё нҡҢліөмҗ лҢҖнң кёлҢҖкҖ мһҲлӢӨ. кұлһҳлҹүмқҖ 3мЎ 922мө мӣҗмқҙлӢӨ. лмӨллҠ нҳмһ 88лҢ 1832мӣҗмҗ кұлһҳлҗҳл, мӢңкҖмҙқмЎмқҖ 120мЎ 2459мө мӣҗмқҙлӢӨ. 24мӢңк лҸҷмҲ 1.83% нҳлқҪнҲмңјл, 1мӢңк лҸҷмҲ 0.40% мғҒмҠнҳм лӢЁкём ҒмңјлЎңлҠ нҡҢліөмёлҘј ліҙмқҙкі мһҲлӢӨ. лмӨлмқҳ кұлһҳлҹүмқҖ 2мЎ 1124мө мӣҗмқҙлӢӨ. лӢкё мқҙлҜёмҖ нҷлҢҖ ліҙкё нңнҺё, мҶлқјлӮҳлҠ 11лҢ 8626мӣҗмҗ кұлһҳлҗҳл 4.28% нҳлқҪнҲлӢӨ. мӢңкҖмҙқмЎмқҖ 67мЎ 4080мө мӣҗмқҙлӢӨ. кҷмқҖ мӢңкҒ нҠёлЎ мқҖ 406мӣҗмҗ кұлһҳлҗҳкі мһҲмңјл 0.46% нҳлқҪ, мӢңкҖмҙқмЎмқҖ 38мЎ 4866мө мӣҗмқҙлӢӨ. лҸмҖмҪмқёмқҖ 143мӣҗмңјлЎң 2.58% нҳлқҪнҲмңјл, мӢңкҖмҙқмЎмқҖ 24мЎ 1702мө мӣҗмқҙлӢӨ. лнҠёмҪмқё мәҗмӢңлҠ 80лҢ 8427мӣҗмҗ кұлһҳлҗҳл 1.07% нҳлқҪнҲлӢӨ. мӢңкҖмҙқмЎмқҖ 16мЎ 1659мө мӣҗмқҙлӢӨ. мҗмқҙлӢӨлҠ 399мӣҗмҗ кұлһҳлҗҳл 2.90% нҳлқҪ, мӢңкҖмҙқмЎмқҖ 14мЎ 3998мө мӣҗмқҙлӢӨ. л ҲмҳӨлҠ 1лҢ 2542мӣҗмҗ кұлһҳлҗҳл 0.51% нҳлқҪнҲкі , мӢңкҖмҙқмЎмқҖ 11мЎ 5560мө мӣҗмқҙлӢӨ. кҷмқҖ мӢңкҒ нҳмқҙнҚјлҰнҖҙлңлҠ 4лҢ 1738мӣҗмңјлЎң 1.93% нҳлқҪнҲмңјл, мӢңкҖмҙқмЎмқҖ 10мЎ 8126мө мӣҗмқҙлӢӨ. мәнҶӨ лӨнҠёмӣҢнҒлҠ 235мӣҗмҗ кұлһҳлҗҳл 2.39% нҳлқҪ, мӢңкҖмҙқмЎмқҖ 8мЎ 9086мө мӣҗмқҙлӢӨ. мІҙмқёлҒнҒлҠ 1лҢ 2570мӣҗмңјлЎң 2.63% нҳлқҪнҲлӢӨ. мӢңкҖмҙқмЎмқҖ 8мЎ 9012мө мӣҗмқҙлӢӨ. лӘЁлӨлЎңлҠ 47лҢ 2904мӣҗмҗ кұлһҳлҗҳл 2.13% нҳлқҪнҲлӢӨ. мӢңкҖмҙқмЎмқҖ 8мЎ 7235мө мӣҗмқҙлӢӨ. лӢӨмқҙлҠ 1451мӣҗмңјлЎң 0.01% нҳлқҪнҲмңјл, мӢңкҖмҙқмЎмқҖ 7мЎ 7872мө мӣҗмқҙлӢӨ. мҠӨнлқјлЈЁлҳмқҖ 234мӣҗмҗ кұлһҳлҗҳл 2.80% нҳлқҪ, мӢңкҖмҙқмЎмқҖ 7мЎ 7123мө мӣҗмқҙлӢӨ. м лҳм ҒмңјлЎң кҖмғҒмһҗмӮ мӢңмһҘмқҖ нҳлқҪмёлҘј ліҙмқҙкі мһҲмңјл, мқјлҖ мўлӘмқҖ лӢЁкё лҳлұмқҳ кҖлҠҘмұмқ ліҙмқҙкі мһҲлӢӨ. нҲмһҗмһҗлӨмқҖ мӢңмһҘмқҳ ліҖлҸҷмұмқ мЈјмқҳ кҠкІҢ мӮҙнјкі мӢ мӨнң нҲмһҗ нҢҗлӢЁмқ н нмҡкҖ мһҲлӢӨ. [мңмҡёмӢ лёкіј MetaVXмқҳ мғқмұнҳ AIкҖ нЁкҳ мһмұнң кёмӮмһлӢҲлӢӨ] м мнҳё кёмһҗ",https:www.seoul.co.krnewseconomyIT2026021920260219500134,https:img.seoul.co.krimgupload20260219SSC_20260219133533_N1.png.webp,서울
